,tn,aspect,polarities
2545,"Go na le mafelo a a kwa godimo kgotsa a a kwa tlase mo lefelong le le kwa tlase ga 8, go a itumedisa go nna le lefelo le le kwa godimo, mme lefelo le lentle, go leta go le thata e bile go le thata gore mong wa lona a se ka a nna a le mo kotsing.",Mme Atmosphere,positive
2547,"Fa o rata dijo tsa lewatle le/kgotsa tsa Segerika, o tla rata lefelo leno le fa e se fela dilo tseno, mme tirelo e boitshega.",Seafood Bone,positive
2549,"Fa o rata dijo tsa lewatle le/kgotsa tsa Segerika, o tla rata lefelo leno le fa go sa lekanyediwe dilo tseno fela, mme dijo di a kgatlha, baiters ba ba sa siamang e bile di le dinnye.",Dijo Tsa Segerika,positive
2552,"Dijo di ne di le monate ka dinako tsotlhe, fela batho ba ba neng ba le mo go yone ga ba a siama, mme ba ba neng ba le mo go yone ga ba a siama.",Dijo tsa rona,positive
2555,"My favorites here are the Tacos Moruti le Tostada de Tinga, mme curried casseroles e thata.",Tacos Pastor,positive
2558,"My Favorites Here Are The Tacos Pastors and The Tostada de Tinga, but Japanese food is better. lololololololololololololololololol",Tostada de Tinga,positive
2560,"Se ke se neng se dira gore ke nne mo ntlong ya me kwa tshimologong, mme le fa go ntse jalo, go na le dilo dingwe tse di nnye.",Mme Décord,positive
2562,"Di-fries tse di nang le nama, nama le ditapole tse di apeilweng go dikologa menu e e akaretsang tsokolate e e tsidifetseng, e e monate, fela dijo di a kgatlhisa, megopo e e kgatlhisang e bile lefelo le lentle.",Baked Potato Bone,neutral
2564,"Di-fries tse di nang le nama, nama le ditapole tse di apeilweng go dikologa menu e e akaretsang tsoko e e tsidifetseng, e e nang le khalori e e monate, fela di-sandwich tsa mo mosong di monate mme sushi e foreshe.",Mme Nady Chili,neutral
2568,"Di-fries tse di boleta, nama le dikuku tse di apesitsweng go dikologa menu e e akaretsang tsoko e e bothitho e e monate, e e nang le mogote, fela tirelo ya bar e bonya e bile e leta go a siama.",Frosy Seno,positive
2570,"Di-fries tse di borethe, nama le ditapole tse di apeilweng go dikologa menu e e akaretsang tsokolate e e bothitho e e bothitho, e e bogale thata, fela tlhotlhwa e kgolo e bile sushi e foreshe.",Menu a Go Go,neutral
2574,"Di-fries tse di borethe, nama ya chili le ditapole tse di apeilweng go dikologa menu e e akaretsang tsokolate e e tsidifetseng, e e nang le mogote, fela tirelo e ela tlhoko mme dijo tsa Setaliana di motlhofo.",Mme Friese,neutral
2577,"Ke tshwanetse go itse gore go na le dingwe tsa dinako tse di fefolwang mo motseng, mme go na le ba ba sa tshwanelang go nna le madi.",dinako tsa go romela,positive
2580,"Dijo di nna di le phepa e bile di siametse go jewa, mme badiri ba a ikgogomotsa.",Dijo tsa rona,positive
2584,"Kofi e botoka go na le di-sandwich tse di feteletseng, fela go na le go ja dijo tse di monate.",Kafe di Kafe,positive
2588,"Kofi e botoka go na le di-sandwich tse di feteletseng, fela di-teas di le dintsi thata.",Sandwiches A Go Go,negative
2591,"Ke ne ke batla fela go ya kwa kofing e e botoka go na le di-starbucks kgotsa tse dingwe tse di tshwanang le tse di tshwanang, mme go leta go sa siama e bile ga go na sepe se se jewang.",Kafe di Kafe,positive
2594,"Fa e le gore o batla dijo tse di monate tsa Setswana, o se ka wa tlhola o batla go nna le dijo tse di oketsegileng, mme o se ka wa dira dilo tse di siameng.",Gong Gong Food Style,positive
2597,"Dijana tsa raese le di-noodle ga se gantsi di feta R50 mme o tsenye mo dinong tse di lapologang tsa ice ka R2 mme o di beela bosigo, fela dikarolo di dinnye.",Dino Gelato,positive
2599,"Dijana tsa raese le di-noodle ga se gantsi di feta R50 mme o tsenye mo dinong tse di lapologang tsa ice ka R2 mme o bewa mo bosigong, mme tirelo e a bo e le setlhogo, dijo tse di monate e bile di jewa.",Reise Dishes,positive
2601,"Dijana tsa raese le di-noodle ga se gantsi di feta R50 mme o tsenye mo dinong tse di lapologang tsa ice ka R2 mme o di beela bosigo, fela di-slices di a tura.",Noodle Dishes Go,positive
2603,"Ka maswabi, re ne ra tlhopha lefelo leno la dijo tsa motshegare fa re ne re ntse re tsamaya go le gontsi mme re ne ra feleletsa re le kwa Borwa jwa Lewatle la St, fela tlhopho ya diinine (segolobogolo Se-Spain) e kgatlhisa e bile e le selo se se kgatlhisang.",Dijo tsa motshegare,neutral
2606,"Ga go na mae a a tala, anchovy, ga go na motlhware wa nicoise, ga go na  onion e khibidu, mme di-rolls tse di nang le crab e kgolo.",Red bone onion,neutral
2609,"Ga go na mae a a tala, ga go na diaparo tsa anchovy, ga go na dioli tsa nicoise, ga go na onion e khibidu, mme menu e farologane, tatso e khutshwane e bile tirelo e na le botsalano.",Nicoise Oliwia,neutral
2612,"Ga go na dijo tse di tala, ga go na le mae, ga go na diaparo tsa anchovy, ga go na tlhware e e khibidu, mme kofi e botoka, sejalo sa Odessa se siame mme di-sandwich tsa mo mosong di monate.",Egg bone,neutral
2615,"Ga go na dijo tse di tala, ga go na mae, diaparo tsa anchovy, ga di na motlhware o o mohibidu, mme dijo di siame.",Go Green Beans Go,neutral
2618,"Ga go na dijo tse di tala, ga go na le mae, ga go na diaparo tsa anchovy, ga go na tlhware e e khibidu, fela lefelo le le bothitho le le mogote thata, kgogo e kgolo le maitemogelo a go jega go maswe.",Mme Ady Dress,neutral
2620,"Go ne go se na sepe se se neng se le monate thata, mme se ne se sa siama, se ne se le monate.",Nicoise salate,negative
2622,"Go na le moo, go na le moo, o ne a akanya gore o ne a batla go apara diaparo tsa salate (go akaretsa go kopa diaparo tsa salate) mme go na le moo a ne a newa quesedilla, fela tlhotlhwa e a utlwala, boleng bo botoka mme tlhopho ya biri e kgolo.",Mmabatho Sasa,neutral
2624,"Go na le moo, go na le moo, o ne a akanya gore o ne a na le dijo tse di monate mme go na le moo, go ne go le monate, go na le moo, go na le",Mme Quesy,neutral
2626,"Go na le moo, mosadi yo o neng a re o ne a itse gore o ne a na le dijo tse di monate(go na le moo, go na le",sasasa kwa,neutral
2628,"Fa a ne a ngongorega, o ne a re: ""Ke maswabi, mme dijo di a bo di le monate e bile di a nwa.",Mme Waitress,neutral
2630,"15% e e sa retelweng, mme dijo tsa se-Spain di ne di le phepa.",Go gratuits,negative
2632,"15% e e sa retelweng e e kwa godimo, fela dijo di le dintsi.",Bill Tsang,negative
2636,"Kuku ya dikuku tsa kwa legodimong ga e monate, mme e tletse ka go tlala. Tirelo e bonya thata mme dijo ga di tsamaelane sentle.",Flavor bone,positive
2640,"Kuku ya dikuku tsa kwa legodimong ga e monate, mme e tletse ka go tlala. Dijo di a jewa, tatso e khutshwane mme tirelo e bonya.",Pisang Goreng Cheese Raspberry Cake,positive
2643,"Dula mo go nngwe ya ditulo tseo tse di iketlileng, mme badiri ba a ikgomotsa.",Disideng,positive
2645,"Go na le moo, lefelo le batho ba le bantsi ba lo lorang ka lone, mme dijo ga di a tshwanela e bile tirelo e bonya.",Mme Atmosphere,positive
2647,"A o ka tswa o batla go itse gore a o na le di-cookie tse di rurufetseng kgotsa tse o di ratang thata, mme go na le di-cookie tse di potlana tse di sa itumediseng.",Sweet sweet mocha,positive
2649,"A o ka tswa o itse gore a o ka tswa o na le di-cookie tse di monate kgotsa tse o di ratang thata, o ka nna wa akanya gore o na le di-cookie tse di sa itumediseng, mme di-cookie tsa gago ke tse di tshosang.",Sweet sweet mocha,positive
2651,"Le fa go ntse jalo, ga go a tshwanela go tsaya metsotso e le 10 go ja dijo tse di monate, mme go na le dijo tse di monate, mme go na le dijo tse di monate.",Dino Bone,neutral
2654,"Le fa go ntse jalo, ga go a tshwanela go tsaya metsotso e le 10 go ja dijo tse di monate mme o se ka wa di nwa.",Menu a Go Go,positive
2656,"Le fa go ntse jalo, ga go a tshwanela go tsaya metsotso e le 10 go dira dijo tse di monate mme o se ka wa nna le dijo tse di lekaneng.",Pizza A Go Go,neutral
2659,"Re ne re tshwanetse go tlogela fela ka gonne go ne go le botlhokwa gore re se ka ra itlhokomolosiwa ke badiri ba ba neng ba le teng - le fa go ne go se na sepe se se kalo, mme lefelo le lentle, tirelo e e kgatlhisang e bile ga e a siama.",Lindiwe Modise,negative
2662,"Dintša tsa gago tsa go ja di a kgatlhisa, fela di a kgatlhisa.",Dinnerware Sets,positive
2665,"11Le tle le be le dihekedi tse leshome le motso o mong, le ditsipa tsa lona, le ditsiane, le ditsipa, le ditsipa, le ditsipa, le ditsiane, le ditsipa, le dishome tse leshome le motso o mong, le dishome tse leshome le motso o mong, le dishome tse leshome le motso o mong, le dishome tse leshome le motso o",Tacos A Go Go,positive
2667,"12Gonne go na le dijo tse di ka nnang lesome le motso o le mongwe, mme o na le dijo tse di bokete tse di ka nnang 12, 200, le fa go ntse jalo, go na le dijo tse di monate, tse di jewang ke dijo tse di monate.",Mme Marguerite,neutral
2669,"12Gonne o na le di-11 tse di ka nnang 11 tsa dijo tse di nang le boupi jo bo boitshegang, mme go na le dijo tse di monate le tse dingwe tse o ka di dirisang.",Dessert a Go Go,neutral
2672,"12Gonne go na le dikano tse di ka nnang lesome le motso o le mongwe, o na le di-11 tse di nang le boupi jo bo boitshegang, mme o na le dijo tse di sa siamang, le fa go ntse jalo, go na le dijo tse di sa siamang.",Mme Burrito,positive
2675,"E siametse go jewa ka bonako, mme le fa go ntse jalo, go na le sopo e e tshesane.",Dijo tsa rona,positive
2677,"Ga e lebe kwa ntle, mme motsotso o o tsamayang mo teng, ke phefo e nngwe e e kwa ntle. Sushi A Go Go - Bigger",Mme Atmosphere,positive
2679,"Ga e lebe kwa ntle, mme motsotso o o tsamayang mo teng, ke phefo e nngwe e e kwa ntle. Sweet sweet-mustard beef sweets.",Masentle Masentle,negative
2682,"Ke ne ke le mo gae go nna ke ne ke le mo gae mme ke ne ke itumetse thata, mme ke ne ke le mokhutshwane.",mme brunch,neutral
2684,"Tsala ya me e ne e na le dikuku tse di monate mme ke ne ke na le dikuku tse di monate, fela dijo di tletse thata ebile di tletse.",Burger A Go Go,neutral
2687,"Tsala ya me e ne e na le dikuku tse di monate mme ke ne ke na le dikuku tse di monate, fela dijo di a boitshega.",Blueberry Pancakes Go,positive
2691,"Re ne re itumetse thata ka dijo tsa rona, mme re ne re itumetse thata fa re bona madi a a kwa godimo, mme Ynass o ne a le kwa godimo thata.",Bill Tsang,positive
2695,"Re ne re itumetse thata ka dijo tsa rona mme re ne re itumetse le go feta fa re bona dijo, mme dijo di a jewa.",Dijo tsa rona,positive
2697,"18Ba tla o tlisetsa dikuku tsa hao, mme o tla ba fa dijo tsa hao, mme o tla di ja, mme o tla di ja.",Kaede Kaede,neutral
2699,"18Ba tla o isa kariki ya hao, mme ba o fa dikuku tse leshome le ba bang ba dikuku tsa hao, mme o di tlisetse dijo tsa hao, mme o di tlisetse tse lokileng.",Mme Tableau,neutral
2701,"18Ba tla o tlisetsa dikuku tsa hao, mme o tla ba fa dijo tsa hao, mme o tla di ja ka dikuku tse 8, mme o tla di ja, mme o tla di ja.",Tlhôpha ya di-sauces,positive
2703,"18Ba tla go naya dijo tse di ka nnang 7 kgotsa 8 mo dijong tsa gago, mme ba tla ja dijo tse di sa siamang, mme ba tla ja dijo tse di siameng.",Mme Steak,neutral
2706,"Go ne go na le sengwe se o ka se solofelang go tswa mo go Ritz, mme go nna le motho yo o sa tshwanelang go nna maitseo, mme go na le motho yo o sa tshwanelang go nna maitseo.",Tirelo Tirelo,positive
2709,"Le fa go ntse jalo, go ne go na le go swa, mme tirelo e ne e le bonya.",Desserts A Go Go,positive
2712,"Boleng jwa nama bo ne bo tsamaelana le lebenkele la gago la di-grocery, fela Calamari ke mofenyi mme nako e e itumedisang e kwa tlase.",Boleng ba nama,negative
2715,"Go na le moo, go na le batho ba ba siameng ba ba ka dirang gore batho botlhe ba itumele, mme ba ba se kang ba kgona go dira dilo tse di sa siamang, mme ba ba sa kgoneng go dira dilo ka tsela e e siameng.",Tirelo Tirelo,positive
2718,"Dijana tse di bidiwang ""Roy's Classics"" (tse di tshwailweng mo menung e e nang le di-asterisks) ke di-recipe tse di lekwang le tsa nnete, jaaka macadamia-crusted mahi mahi mahi, kgotsa subtly sweet honey-mustard beef ribs short ribs, but sushi is bigger and is edible.",Mme Roy's Classics,positive
2721,"Dijana tse di bidiwang ""Roy's Classics"" (tse di tshwailweng mo menung e e nang le di-asterisks) ke di-recipe tsa lekwa-le-nnete, tse di jaaka macadamia-crusted mahi mahi, kgotsa subtly sweetly sweet sweet honey-mustard beef ribs short ribs, but mabone ga a na go feretlhega, di-cookie tsa leruo ke ngongorego mme mmino o bokete thata.",Mme Macadamia-crusted mahi mahihi,positive
2724,"Dijana tse di bidiwang ""Roy's Classics"" (tse di tshwailweng mo menung e e nang le di-asterisks) ke di-recipe tse di lekwang le tsa nnete, jaaka macadamia-crusted mahi mahi mahi, kgotsa subtly sweet sweet honey-mustard beef ribs short ribs, but service is worst, bill is big and dinners is a power.",Dishes Tsang,positive
2727,"Dijana tse di bidiwang ""Roy's Classics"" (tse di tshwailweng mo menung e e nang le di-asterisks) ke di-recipe tse di lekwang le tsa nnete, tse di jaaka macadamia-crusted mahi mahi, kgotsa subtly sweet honey-mustard beef ribs short ribs, but sushi is bigger, tirelo is bad and service is worst.",sweet sweet sweet-mustard beef ribs,positive
2729,"Dijana tse di bidiwang ""Roy's Classics"" (tse di tshwailweng mo menung e e nang le di-asterisks) ke di-recipe tsa lekwa-le-nnete, jaaka macadamia-crusted mahi mahi, kgotsa subtly sweet sweet sweet honey-mustard beef ribs short ribs, but ambiance is romantic, onion rings is better and vegetables are distinctive.",Menu a Go Go,neutral
2732,"Dijana tse di bidiwang ""Roy's Classics"" (tse di tshwailweng mo menung e e nang le di-asterisks) ke di-recipe tse di lekwang le tsa nnete, jaaka macadamia-crusted mahi mahi mahi, kgotsa subtly sweet sweet sweet honey-mustard beef ribs short ribs, but ground chickpea soup is thin and service is worst.",Recipes tsa,positive
2734,"10.1 1.2 1 1 1 2.1 1 1 2.1 1 2 10 Ke ʻo ke ʻaʻo ʻo ke ʻana, a me ka ʻoʻaoʻao ʻao ʻaoʻao ʻao ʻao ʻaoʻao ʻao Ke ne ke leka go dirisa di-cookie le di-cookie tse di sa tswang go nna di le phepa.",sweetsas,neutral
2737,"10.1 1.2 1 1 1 2.1 1 1 2.1 1 2 10 Ke ʻo ke ʻaʻo ʻo ke ʻana, a me ka ʻoʻaoʻao ʻao ʻaoʻao ʻao ʻao ʻaoʻao ʻao Go nna mo setulong se se sa itumediseng mme tirelo ya gago ga e a siama.",Dessert a Go Go,positive
2739,"10.1 1.2 1 1 1 2.1 1 1 2.1 1 2 10 Ke ʻo ke ʻaʻo ʻo ke ʻana, a me ka ʻoʻaoʻao ʻao ʻaoʻao ʻao ʻao ʻaoʻao ʻao Food Gone Bad.",Whisky A Go Go & Peanut Butter Tart,positive
2743,"Go na le mefuta e e farologaneng ya dijo tse di farologaneng, go akaretsa dijo tse di monate le di-cookie tse di kwa godimo, go na le mefuta e le mmalwa ya nama e e seng ya nama, fela e ne e se dijo tse di monate.",Steaks A Go Go,positive
2745,"Go na le mefuta e e farologaneng ya dijo tse di farologaneng, go akaretsa dijo tsa lewatle tse di foreshe le di-steak tse dikgolo, gape go na le mefuta e le mmalwa ya mefuta e e seng ya nama, fela disoseine tse di monate tsa setaliana di bokete, kgogo ke lorato le go tsena ga konyana go monate.",Non-meat alternatives kwa,neutral
2749,"Go na le mefuta e e farologaneng ya dijo tse di monate, go akaretsa dijo tse di monate le di-cookie tse dikgolo, go na le mefuta e le mmalwa e e seng ya nama, mme go na le dipanekuku tse di sa itumediseng.",Seafood Bone,positive
2753,"Go na le mefuta e e farologaneng ya dijo tse di kwa godimo, go akaretsa le di-cookie tse di kwa godimo, go na le mefuta e le mmalwa e e seng ya nama, mme badiri ga ba a tshwanela go nna le madi a mantsi.",Go Insa,positive
2757,"Go na le mefuta e e farologaneng ya dijo tse di farologaneng, go akaretsa dijo tse di monate le dijo tse dikgolo, go na le mefuta e le mmalwa e e seng ya nama, fela dijo di a swabisa.",Dinnerbone Menu,positive
2761,"Go na le dilo tse di sa tlwaelegang, go tswa mo lefelong le lentle le lentle, go ya kwa lefelong le lentle le le nang le dikotla, mme go na le mogote o o sa tlwaelegang.",Tirelo Tirelo,positive
2765,"Go na le dilo tsotlhe tse di sa tlwaelegang, go tswa kwa bathong ba ba nang le didirisiwa tse di molemo, go ya kwa godimo, mme go na le dilo tse di sa siamang tse di sa siamang.",Mme Waitresses,positive
2769,"Go na le dilo tsotlhe tse di sa tlwaelegang, go tswa mo tirong e e kgatlhisang e e siameng, go ya kwa go lefaufaung e e kwa godimo thata, mme phaposi e a bonala sentle.",Mme Atmosphere,positive
2772,"Go na le moo, go dira gore go nne le mogote o o sa iketlang, mme go na le ba bangwe ba ba sa iketlang le go leta.",Mme Atmosphere,positive
2774,"""Ke ne ke batla go ja dijo tse di monate, mme ke ne ke le mo dijong tse di neng di le tsididi thata jaana, fela ke ne ke sa kgone go ja dijo tse di neng di le tsididi thata, mme ke ne ke sa kgone go ja dijo.",Mme Served,neutral
2776,"Ke ne ke batla go ja dijo tse di neng di le monate, mme ke ne ke na le dijo tse di neng di le gaufi thata le go ja dijo tse di neng di le tsididi thata, mme ke ne ke sa kgone go ja dijo tse di monate mme dijo tsa kwa Japane di ne di le monate.",Dijo tsa rona,negative
2779,"""Ke ne ke batla go ja dijo tse di monate, mme tsotlhe tse ke neng ke na le tsona di ne di le mo dijong tse di neng di le tsididi thata, mme re ne re sa kgone go ja dijo tse di monate.",Dijo tsa rona,negative
2781,"Go lebega go ne go se na ope yo o neng a ka leka go ja dijo, mme go ne go se na ope yo o ka gakololang beine epe fela, fela dintša tse di bothitho di a itumedisa.",Dijo tsa rona,neutral
2783,"Go lebega go ne go lebega go se na ope yo o neng a leka go ja dijo, mme go ne go se na ope yo o ka re nayang dijo, mme dijo tse di apeilweng di a gakgamatsa.",Whisky A Go Go,neutral
2785,"Go ne go lebega go ne go se na ope yo o neng a ka leka go ja dijo tse di monate, mme go ne go se na ope yo o ka rekelang beine, mme dijo tsa mo mosong di a kgatlhisa.",Mme Waitress,negative
2789,"ʻO ke ʻano o ka mea, Go nna pelonomi e bile go na le bopelonomi jo bo sa rerisiweng.",Mme Lysa Appetizer,neutral
2793,"ʻO ke ʻano o ka mea, Di-cookie ga di a siama, mme di-cookie tse di tala ga di jelwe.",Mme Fanny Gras,positive
2795,"Go na le dijo tse di kwa godimo thata - go na le dijo tse di tlhwatlhwakgolo, mme go na le dijo tse di sa jeng sentle, mme go na le dijo tse di kwa godimo.",Mme Served,positive
2799,"Go na le dilo tse di sa tshwaneng le tse di kwa godimo - tse di tlhwatlhwakgolo mme di a dirwa mo maemong a a kwa tlase, mme go a itumedisa.",Go Set,positive
2803,"Go na le dilo tse di tlhwatlhwakgolo - tse di tlhwatlhwakgolo mme di direlwa mo maemong a a kwa tlase, mme di-casseroles tsa kwa godimo di thata.",Italian Items A Go Go,positive
2807,"Ka jalo, go ne go se na sepe se se sa siamang, se se sa siamang, mme tirelo e a fokotsega, mme tirelo e a boitshega.",Dikarolo tsa dikarolo,positive
2811,10.11.18.10 12.10 12.18.10 12.10 12.12.12.12.12.12.10 O se ka wa nna le di,Pasta A Go Go,positive
2815,"18- Al sweatpants, no sweats, but sweats.",Mme Sauce,neutral
2817,"Re ne re itumelela go dira dilo sentle mme re tla bo re boela kwa dijong, mme dijo ga di a siama.",Desserts bone,positive
2821,"Menu ya ka e e kgatlhisang le ya boitlhamedi e akaretsa dijana tsa sejapane tsa segompieno, tse di jaaka Foie Gras Unagi Unagi Napolean, Jap style hamburger steak, spicy cod roe roe spaghetti, cod e ntsho e e nang le motheo wa miso, le rack ya konyana ka soso ya truffle e ntsho, go reela di le mmalwa, fela dinner is nice and service is tops.",Strawberry strawberry,neutral
2825,"Menu ya ka e e kgatlhisang le ya boitlhamedi e akaretsa dijana tsa sejapane tsa segompieno, tse di jaaka Foie Gras Unagi Unagi Unagi Napolean, Jap style hamburger steak, spicy cod roe roe spaghetti, cod e ntsho e e nang le motheo wa miso, le rack ya konyana ka soso ya truffle e ntsho, go raya tse mmalwa, fela tirelo e kgolo.",Go go gadget unagi napolean,neutral
2829,"Menu ya ka e e kgatlhisang le ya boitlhamedi e akaretsa dijana tsa sejapane tsa segompieno, tse di jaaka Foie Gras Unagi Unagi Unagi Unagi Napolean, Jap style hamburger steak, spicy cod roe roe spaghetti, cod e ntsho e e nang le motheo wa miso, le rack ya konyana ka soso ya truffle e ntsho, go reela di le mmalwa, fela tirelo e botsalano, salate e siame e bile e le kgolo.",Black Cod E nang le Miso Base,neutral
2833,"Menu ya ka e e kgatlhisang le ya boitlhamedi e akaretsa dijana tsa sejapane tsa segompieno, tse di jaaka Foie Gras Unagi Unagi Napolean, Jap style hamburger steak, spicy cod roe roe spaghetti, cod e ntsho e e nang le motheo wa miso, le rack ya konyana ka soso ya truffle e ntsho, go reela di le mmalwa, fela hostess ke setlhogo mme molaodi ga a na graceless.",Menu a Go Go,positive
2837,"Menu ya ka e e kgatlhisang le ya boitlhamedi e akaretsa dijana tsa sejapane tsa segompieno, tse di jaaka Foie Gras Unagi Unagi Napolean, Jap style hamburger steak, spicy cod roe roe spaghetti, cod e ntsho e e nang le motheo wa miso, le rack ya konyana ka soso ya truffle e ntsho, go raya tse mmalwa, fela ditheko di a utlwala.",Go GoA Gone Black Truffle Sauce,neutral
2841,"Menu ya ka e e kgatlhisang le ya boitlhamedi e akaretsa dijana tsa sejapane tsa segompieno, tse di jaaka Foie Gras Unagi Unagi Unagi Napolean, Jap style hamburger steak, spicy cod roe roe spaghetti, cod e ntsho e e nang le motheo wa miso, le rack ya konyana ka soso ya truffle e ntsho, go reela di le mmalwa, fela di-appetizers ga di tlhwatlhwa e bile dijo ga di theko e tlase.",jap ya dishes,neutral
2845,"Menu ya ka e e kgatlhisang le ya boitlhamedi e akaretsa dijana tsa sejapane tsa segompieno, tse di jaaka Foie Gras Unagi Unagi Napolean, Jap style hamburger steak, spicy cod roe roe spaghetti, cod e ntsho e e nang le motheo wa miso, le rack ya konyana ka soso ya truffle e ntsho, go reela di le mmalwa, fela dijo tsa motshegare ke tse di monate le tse di tsididi tsa sesame noodles di delectable.",Jap style hamburger bak kwa,neutral
2849,"18Ke ka moo ke ratang ka teng, mme letsatsi la me ke le monate, le fa go ntse jalo.",Desserts bone,positive
2853,"12Ditlhamo tsa me ke tse di ratwang ke go jewa ke letsatsi la me la matsalo, mme le fa go ntse jalo, ga go na sepe se se jewang.",Tart Motshegare,positive
2857,"Dijo tse di monate, dijo tse di monate, ga di a tshwanela go leta, fela ditafole ga di a siama.",Tirelo Tirelo,positive
2861,"Dijo tse di monate, dijo tse di monate, ga di a tshwanela go leta, mme ga di a tshwanela go nna le letswai le le monate.",Lindiwe Letang,positive
2865,"Dijo tse di monate, dijo tse di monate, boleng jo bo siameng, ga di a tshwanela go leta mo moleng, mme nama ya maitirelo ke ya maitirelo, tirelo ga e a siama e bile batho ba ba rekisang ga ba a tshwanela.",Valobasha,positive
2869,"Dijo tse di monate, dijo tse di monate, ga di a tshwanela go leta, fela tirelo e bonya, e a tenega e bile e a tenega.",Dijo tsa rona,positive
2872,"Go botlhokwa go ja dijo tse di monate tse di jewang kwa Chelsea, fela a re ke go tlhoka dijo tse di monate, go ja dijo tse di sa siamang.",Dinnerbone,positive
2874,"Ke ne ke le mo malatsing a le mmalwa a a fetileng, ke ne ke le mo malatsing a le mmalwa a a fetileng, ke ne ke le mo malatsing a le mmalwa a a fetileng, ke ne ke le mo malatsing a a fetileng, ke ne ke le mo malatsing a le mmalwa a a fetileng, ke ne ke le mo malatsing a a fetileng ke ne ke le mo ntlong ya me ya go ja dijo tse di monate, mme ke ne ke le mo go yone.",Dining Room Sets Dining Room Sets,neutral
2877,"Dijo tse di neng di le mo teng ga tsone di ne di le monate, fela dijo di ne di le mogote thata, mme dijo di ne di le mogote thata.",Dikarolo tsa dijo,neutral
2879,"Ke eng se se ka dirang gore go nne le tsholofelo ya go nna mo tirelong e e tshwanang le eno, mme naan e nonofile thata e bile go na le maemo a a siameng.",Tirelo Tirelo,negative
2883,"Tlhotlhwa e e kwa godimo e e kwa godimo e e kwa godimo thata, fela tlhotlhwa e e kwa godimo ga e a tshwanela, e bile ga e a siama.",Asian salad bone,positive
2887,"Best spicy tuna roll, great asian salad, but waiter is a rudeness and manager is a rudeness. lolololololololololololololololololololol",Go go go spicy tuna roll,positive
2890,Leka go ja dijo tse di sa siamang (e seng go ja dijo tse di sa siamang) mme dijo tse di sa siamang di a swabisa.,Rosangela Roll,positive
2892,Try The Rose Roll (Not On The Go) - 2016,Menu a Go Go,neutral
2894,"Go na le dilo di le dintsi tse di ka dirang gore go nne le didirisiwa tse di oketsegileng - go ka tswa go na le dijo tse di nang le dikotla, mme ditlhwatlhwa ga di a siama.",Roof Tile Bar,neutral
2896,"Go na le dilo di le dintsi tse di ka dirang gore go nne le didirisiwa tse di molemo, mme go na le dilo tse dintsi tse di nang le boleng jo bo kwa godimo.",Ditafole,negative
2900,"Le fa go ntse jalo, go na le dikaka tse di gakgamatsang tse di gakgamatsang tse di sa tlwaelegang le tse di sa tlwaelegang tse di sa tlwaelegang, mme go na le batho ba ba sa dumeleng go gaisa ba bangwe.",Mme Deserts,positive
2904,"Go na le dikaka tse di gakgamatsang tse di sa tlwaelegang le tse di sa tlwaelegang, mme go na le batho ba ba sa kgoneng go dira dilo tse di bosula le go leta go le thata.",Entrée Mme,positive
2907,"Go na le dikaka tse di gakgamatsang tse di sa tlwaelegang le tse di gakgamatsang thata, mme tirelo e bonya thata, lefelo le le monate e bile le na le dijo tse di kwa godimo.",Gae Sekgoa go ya go Setswana guacamole,positive
2910,"Fa e le gore o na le bothata jwa go dira gore o se ka wa kgobega marapo, o ka se ka wa kgobega marapo, mme go na le dilo tse dintsi tse o ka di itumelelang.",Tequila Tirona,positive
2912,'O tlaa ja nama ya gago' - It was a bottle of the food but it wasn't cooked for fresh and prices are good,Whisky A Go Go,neutral
2915,"Go na le dilo tse di siameng, ka jalo, go botoka gore o kgone go dira dilo tse di farologaneng, mme go na le dilo tse di sa siamang tse di ka dirang gore o kgone go dira jalo.",Ditafole,negative
2918,"Dijo di ne di le bonya mme ka bobedi di a bereka, mme tirelo e bonya thata.",Mme Décord,positive
2921,"Dijo di ne di tshwana le tsa botsotsi mme ka bobedi di ne di le teng, mme mong wa tsona ke wa nnete.",Dijo tsa rona,positive
2925,"A re go ne go le motlhofo gore o se ka wa ja dijo tse di monate, mme o ne o sa kgone go ja dijo tse di monate.",Dessert a Go Go,negative
