sentences,aspects,polarities
"masu ba da abinci suna da sauƙin hali kuma suna taimaka maka kuma idan ka riƙa zuwa wurinsu a kai a kai za su tuna da kai, amma kuɗin yana da tsada sosai, sosin ba shi da laushi sosai kuma hidima tana da sauri.",masu,positive
"abin da ake ci yana da kyau kuma ana ciyar da shi da sauri, amma kogin zafi ne mafi muni kuma ma'aikatan suna girman kai.",ci,positive
"abin da ake ci yana da kyau kuma ana ciyar da shi da sauri, amma sufi na ƙasa ba shi da wuya, ɗanɗano yana da wuya kuma kujerun da ake buɗe ba shi da sauƙi.",ciyar,positive
"ni da mijina mun je wurin aƙalla sau shida kuma a koyaushe ana ba mu abinci mafi girma kuma sau da yawa abinci na ƙwaya, amma biyan",abinci,positive
"ni da mijina mun kasance a wurin aƙalla sau shida kuma a koyaushe ana ba mu abinci mafi girma kuma sau da yawa abinci na ƙwaƙwalwa, amma hidima ta yi sanyin gwiwa.",abinci,positive
"idan kana son ka ɗanɗana abinci mai kyau na indiya kuma kana son hidima mai kyau, babu shakka ka ziyarci curry leaf, amma ɗanɗano ba shi da tsawo kuma ɗakin ya kasance da sauƙi.",abinci,positive
"idan kana son ka ɗanɗana abinci mai kyau na indiya kuma kana son hidima mai kyau, ka ziyarci curry leaf, amma manajan ba shi da kyau kuma masu sayar da bar suna da ban sha'awa.",abinci,positive
"el nidos ɗaya ne cikin manzannin da suka fi kyau a new york da na taɓa zuwa, yana da irin pizza mai laushi, mai ruwan bakin, amma keki a tsawon",pizza,positive
"an yi pizza mai daɗi, mai daɗi, kuma a shirye a yi masa hidima, amma ɗan'uwa mai ɗan",pizza,positive
"aikin da muka shaida yana da kyau kuma yana da kyau, amma mai ba da barin ba shi da kyau kuma mai kula da shi ba shi da kyau.",aikin,positive
"na iya cewa ƙanƙara, burger da salad dukansu shafaffu ne, mai laushi kuma mango margareta da $ 9 ya yi daidai da kuɗin, amma masu biya ba su da kyau, mai ba da bar yana da rashin hankali kuma ma'aikatan jira ba su da hankali.",salad,positive
"na iya cewa ƙanƙara, burger da salad dukansu shafaffu ne, masu laushi kuma mango margareta da $ 9 ya yi daidai da kuɗin, amma hidima ta bar tana da sauri kuma cin abinci yana da iko.",mango margareta,positive
"na iya cewa ƙanƙara, burger da salad dukansu shafaffu ne, masu laushi kuma mango margareta da $ 9 ya yi daidai da kuɗin, amma casseroles da aka ƙwace da ƙwaƙwalwa yana da tsanani kuma ɗakin ba shi da wuya.",casseroles,positive
"na iya cewa, ƙanƙara, burger da salad dukansu shafaffu ne, masu laushi kuma mango margareta da $ 9 ya yi daidai da kuɗin, amma hidima ba ta da kyau, ƙanƙara suna da tsada kuma abinci ya yi sanyin gwiwa.",burger,positive
"yanzu ana kiran nikki sushi, sushi yana da kyau, amma abinci ba shi da tsada, jerin ruwan inabi yana sa baƙin ciki kuma wurin yana da kyau.",sushi,neutral
"sabon hamburger da saus na musamman yana da kyau - aƙalla mafi kyau fiye da mac mai girma, amma kuki na fortune ƙarya ne kuma abincin da ake ci ya fi muni.",hamburger,positive
"sabon hamburger da saus na musamman yana da kyau - aƙalla mafi kyau fiye da mac mai girma, amma ana gwada da kuma gaskiya, zaɓe-zaɓe na vegan da yawa ne kuma abinci yana da kyau.",mac,negative
"amma, filet mignon ba shi da kyau sosai a dukan sa'ar shan abinci ya haɗa da appetizers na kyauta (zaɓi mai kyau da ba sushi ba); ɗan'uwa mai rashin hankali ne, bill babba ne kuma manajan rashin hankali ne.",sushi,positive
"amma, filet mignon ba shi da kyau sosai a dukan sa'ar shan abinci ya haɗa da appetizers na kyauta (zaɓi mai kyau da ba sushi ba); mai ba da abinci mai rashin hankali ne.",appetizers,positive
"amma, filet mignon ba shi da kyau sosai a dukan sa'ar shan abinci ya haɗa da appetizers na kyauta (zaɓi mai kyau da ba sushi ba); ɗan laushi ba shi da sauƙi kuma kukis masu arziki ƙarya ne.",sa'ar,positive
"amma, filet mignon ba shi da kyau sosai a dukan sa'ar shan abinci ya haɗa da appetizers na kyauta (zaɓi mai kyau da ba sushi ba); abinci yana da ban sha'awa.",filet mignon,negative
"wannan ne kaɗai za mu iya zuwa kuma mu so mu ci abinci na italiya, amma hamburger mai laushi ne.","italiya,",neutral
"suna da masu ƙwazo a kan tafiyar da suke ƙoƙarin su jawo ka wanda ya sa mu yi shakka, amma saketini mai ban sha'awa ne kuma mutane ba su da kyau.",ne,neutral
"lasagna wataƙila ita ce mafi kyau da na taɓa ɗanɗana, amma cin abinci yana da ban sha'awa, daji duhu ne kuma mai kula da shi ba shi da kyau.",lasagna,positive
"mazaɓen yana da ban sha'awa kuma yana da tsada, amma mai ba da abinci ba shi da sauƙi kuma abinci ba shi da sauƙi.","tsada,",positive
"abin da ake ci yana da ban sha'awa kuma yana da tsada sosai, amma mutane ba su da kyau kuma ba sa son a kai su.",abin,positive
"abin da ake ci yana da laushi kuma ana amfani da abinci mai daɗi, amma ba a yi amfani da shi da sauri kuma abincin yana da ban sha'awa.",amfani,positive
"abin da ake ci yana da laushi kuma ana amfani da abinci mai daɗi, amma abincin ba shi da sauƙi kuma girmansa yana da yawa.",abinci,positive
"ma'aikatan suna da sauƙin hali da kuma daɗi, amma haske ba shi da kyau kuma ba a yi masa abinci ba.",ma'aikata,positive
"ɗakin yana da sauƙi, amma yana da wuya a sa irin wannan ƙaramin wuri ya zama mai ban sha'awa kuma ba zan shawarce shi ba a matsayin dalilin da ya sa ba za a tafi ba; maratha tana da sabon jiki.",ƙaramin,negative
"ɗakin yana da sauƙi, amma yana da wuya a sa irin wannan ƙaramin wuri ya zama mai ban sha'awa kuma ba zan shawarce shi ba a matsayin dalilin da ya sa ba za a tafi ba; abincin dare yana da kyau kuma saketini yana da ban sha'awa.",wuri,negative
"an yi cin abinci mai kyau a wannan wurin abinci na teku, an shirya abinci sosai kuma an gabatar da shi kuma hidima tana da kyau kuma tana da gaggawa, amma abincin yana da tsada, ma'aikatan suna girman kai kuma suna yin hidima a bar da sauri.",ma'aikatan,positive
"an yi cin abinci mai kyau a wannan abinci na teku, an shirya abinci sosai kuma an gabatar da shi kuma hidimar tana da daɗi kuma tana da gaggawa, amma sanyi mai cike da zafi ba abin cin ba ne, ɗan gidan ba shi da kyau kuma shan shanin duhu ne.",abinci,positive
"an yi cin abinci mai kyau a wannan abinci na teku, an shirya abinci sosai kuma an gabatar da shi kuma hidima tana da kyau kuma tana da gaggawa, amma jira ba shi da kyau, sanyi mai cike da zafi ba zai iya cinsa ba kuma girmansa yana da yawa.",cin abinci,positive
"wani wuri mai kyau, muddin ba a yawan yawan mutane kuma ibada ta ɗaya ga abincin da ta zaɓa ta sa mare zaɓi mai kyau ga masu son abinci na teku, amma ɗakin yana da sauƙi kuma keki yana da tsawon",abinci,positive
"wani wuri mai kyau, muddin ba ya yawan mutane kuma ibada ta ɗaya ga abincin da ta zaɓa ta sa mare zaɓi mai kyau ga masu son abinci na teku, amma waƙa tana da nauyi, mai mulkin ƙarya ne kuma sosin mole yana da daɗi.",abinci na teku,positive
"da dukan wurare na duniya ko kuma na ƙasa a hanyar 8 yana da kyau a samu ɗaya da ke sama a cikin ƙasa da ƙasa, amma ma'aurata na disco pop suna da ban sha'awa kuma ƙasa tana da tsawon",cikin,positive
"da dukan wurare na duniya ko kuma na ƙasa a hanyar takwas yana da kyau a samu ɗaya da ke sama a cikin ƙasa da ƙasa, amma wuri mai laushi ne, jira yana da rashin hankali kuma mai mulkin ƙarya ne.",yana,positive
"idan kana son abinci na teku da/ko kuma abincin helenawa za ka so wannan wurin ko da yake ba waɗannan abubuwa kawai ba ne, amma hidima tana da ban sha'awa.",abinci na teku,positive
"idan kana son abinci na teku da/ko kuma abincin helenawa za ka so wannan wurin ko da yake ba waɗannan abubuwa kawai ba ne, amma abinci mai kyau ne, masu ƙwaƙwalwa ba su da kyau kuma abincin ƙaramin ne.",abincin,positive
"abin da ake ci koyaushe yana da kyau, amma masu ba da abinci ba su da kyau, mai ba da bar yana da rashin hankali kuma ɗan gidan ba shi da kyau.",abinci,positive
"abin da nake so a nan shi ne tacos pastor da tostada de tinga, amma casseroles da aka ci da ƙwaƙwalwa suna da tsanani.",tacos pastor,positive
"abin da nake so a nan shi ne tacos pastor da tostada de tinga, amma abincin japan ya fi kyau.",tostada de tinga,positive
"da farko, ado ne ya sa na shiga ƙofar, amma abincin ba shi da yawa.",ado,positive
"friji mai tsanani, cili mai nauyi da ƙwaƙwalwa da aka ƙwace a cikin abinci da ya ƙunshi mai sanyi, mai tsananin tsokolai frosty, amma abinci mai ban sha'awa ne, rolls yana da kyau kuma wurin yana da kyau.",ƙwaƙwalwa,neutral
"friji mai tsanani, cili mai nauyi da kuma ƙwaƙwalwa da aka ƙwace sun cika abinci da ya ƙunshi tsokolai mai sanyi, mai tsanani frosty, amma sandwichi na fara'a suna da ban sha'awa kuma sushi shafaffu ne.",cili,neutral
"friji mai tsanani, cili mai nauyi da kuma ƙwaƙwalwa da aka ƙwace sun cika abinci da ya ƙunshi mai sanyi, mai tsanani mai tsanani frosty, amma aikin bar yana da sauri kuma mai ƙwaƙwalwa rashin hankali ne.","frosty,",positive
"friji mai tsanani, cili mai nauyi da kuma ƙwaƙwalwa da aka ƙwace sun cika abinci da ya ƙunshi tsokolai mai sanyi, mai tsanani frosty, amma kuɗin yana da kyau kuma sushi yana da shafaffu.",abinci,neutral
"friji mai tsanani, cili mai nauyi da kuma ƙwaƙwalwa da aka ƙwace sun cika abinci da ya ƙunshi mai sanyi, mai tsanani mai tsanani frosty, amma hidima tana mai da hankali kuma abincin italiya yana da sauƙi.",friji,neutral
"na ce suna da ɗaya daga cikin lokaci mafi sauƙi na aika wa mutane a birnin, amma ɗan gidan ba shi da kyau.",lokaci,positive
"kullum abinci yana da daɗi kuma yana shirye ya ci, amma ma'aikatan suna girman kai.",abinci,positive
"cafi yana da kyau fiye da sandwichi na cosi masu tsada, amma cin abinci ya fi muni.",cafi,positive
"cafi yana da kyau fiye da sandwichi na cosi masu tsada, amma shayi yana da kyau.",sandwichi na cosi,negative
"nakan tafi don shayi da ya fi starbucks ko irinsa, amma masu ɗan ƙwazo ba su da kyau, jira ba shi da kyau kuma sanyi mai cike da zafi ba zai iya cinsa ba.",fi,positive
"idan kana neman abinci na hong kong, kada ka ƙara duba, amma ma'aikatan ba su da kyau.",hong,positive
"abinci na ƙwaya da kuma abinci na nodoli ba su fi $5 ba kuma ka ƙara da shan ƙanƙara mai ban sha'awa da $ 2 kuma an shirya ka don dare, amma abincin ƙaramin ne.",shan,positive
"abinci na ƙwaya da abinci na nodoli ba su fi $5 ba kuma ka ƙara da shan ƙanƙara mai ban sha'awa da $ 2 kuma an shirya ka don dare, amma hidima ba ta da kyau, mai daɗi mai girma ne kuma abinci yana da kyau.",abinci na ƙwaya,positive
"abinci na ƙwaya da kuma abinci na nodoli ba su fi $5 ba kuma su ƙara da shan ƙanƙara mai ban sha'awa da $ 2 kuma an shirya ka don dare, amma ƙanƙara suna da tsada.",abinci na nodoli,positive
"abin baƙin ciki, mun zaɓi wannan wurin don cin abinci da yake mun yi tafiya da yawa kuma muka ƙare a south st seaport, amma zaɓen ruwan inabin (ainihi na sifanisanci) yana da ban sha'awa kuma yana da launi mai kama da velvet.",abinci,neutral
"ba za a yi ƙwaya ba, ba za a yi ƙwaya ba, ba za a saka anchovy ba, ba za a yi amfani da zaitun ba, ba za a yi alkama ba, amma ƙanƙara tana da kyau.",ƙanƙara,neutral
"ba za a yi ƙwaya ba, ba za a yi ƙwaya ba, ba za a yi anchovy ba, ba za a yi amfani da zaitun ba, ba za a yi amfani da alkama ba, amma abinci dabam dabam ne, ɗanɗano ba shi da tsawo kuma hidima tana da kyau.",zaitun,neutral
"ba za a yi ƙwaya ba, ba za a yi ƙwaya ba, ba za a saka anchovy ba, ba za a yi amfani da zaitun ba, ba za a iya yin alkama ba, amma kafa ta fi kyau, daji na ƙasar amirka yana da kyau kuma sandwichi na fara'a suna da ban sha'awa.",ƙwaya,neutral
"ba za a yi ƙwaya ba, ba za a yi ƙwaya ba, ba za a saka anchovy ba, ba za a yi amfani da zaitun ba, ba za a yi alkama ba, amma abinci yana da kyau.",zaitun,neutral
"ba za a yi ƙwaya ba, ba za a yi ƙwaya ba, ba za a saka anchovy ba, ba za a yi amfani da zaitun ba, ba za a yi alkama ba, amma wurin yana da kyau sosai, daji yana da kyau kuma cin abinci yana da muni sosai.",anchovy,neutral
"hakika, wannan ba salad na nicoise ba ne kuma ba a iya cinsa ba, amma sushi ne mafi kyau.",salad na nicoise,negative
"matar da ke kusa da mu ta yi tunanin cewa ta zaɓi salad (haɗe da neman salad) kuma maimakon haka an ba ta quesedilla, amma kuɗin ya dace, kwanciyar hankali ta fi kyau kuma zaɓan bira yana da kyau.",salad,neutral
"matar da ke kusa da mu ta yi tunanin cewa ta zaɓi salad (haɗe da neman salad) kuma maimakon haka an ba ta quesedilla, amma abinci mai laushi ne, abinci yana da kyau kuma ma'aikatan suna da kyau.",quesedilla,neutral
"matar da ke kusa da mu ta yi tunanin cewa ta zaɓi salad (haɗe da neman salad) kuma maimakon haka an ba ta quesedilla, amma abinci mai kyau ne kuma ma'aikatan sun san.",salad,neutral
"sa'ad da ta yi gunaguni, ɗan'uwan ta ce, ""ka gafarta, amma abinci mai kyau ne kuma abin sha yana da ban sha'awa.",ban,neutral
"15% na kuɗin da aka ƙara farat ɗaya ga biyan biyan, amma abincin italiya yana da shafaffu.",ga,negative
"15% na kuɗin da aka ƙara farat ɗaya ga biyan biyan, amma abinci mai kyau ne.",kuɗin,negative
"keki na ƙokula na raspberry yana da sama- ba mai daɗi ba, amma cike da laushi; aikin yana da sauri sosai kuma abincin ba shi da kyau.",cike,positive
"keki na ƙokula na raspberry yana da sama- ba mai daɗi ba, amma cike da laushi; abincin abinci yana da kyau, ɗanɗano yana da gajeren lokaci kuma sabis yana da sauri.",raspberry,positive
"ka zauna a cikin ɗaya daga cikin kujerun da ke da sauƙi, amma sanda mai girman kai ne.",kujerun,positive
"yanayin yana kai ka wurin, wurin da mutane da yawa suke ɗokin yi, amma abinci ba shi da amfani kuma hidima tana da sauri.",yana,positive
"ko ka zaɓi mocha da aka haɗa da ƙanƙara ko kuma mocha mai fari mai zafi, babu shakka za ka yi farin ciki sosai, amma wasu sashen ƙaramin ne kuma keki na dukiya gunaguni ne.",mocha,positive
"ko ka zaɓi mocha da aka haɗa da ƙanƙara ko kuma mocha mai fari mai zafi, babu shakka za ka yi farin ciki sosai, amma keki na dukiya ƙarya ne, hidima tana da ban sha'awa kuma masu sayar da bar suna da ban sha'awa.",mocha,positive
"ko da yake akwai abinci mai kyau, bai kamata ya ɗauki minti goma ka samu shanka da 45 don pizza na ƙwai ba, amma sufi yana da zafi, mai daɗi mai girma ne kuma cin abinci mafi muni.",abinci,neutral
"ko da yake akwai abinci mai kyau, bai kamata ya ɗauki minti goma ka sha abinci da kuma 45 don ka ci pizza, amma ɗan gidan ba shi da kyau.",abinci,positive
"ko da yake akwai abinci mai kyau, bai kamata ya ɗauki minti goma ka sha abinci da kuma 45 don ka ci pizza, amma wurin yana da sauƙi.","pizza,",neutral
"a ƙarshe mun bar domin ainihi ma'aikatan jiran suna ƙyale mu-- ko da sauran manzannin ba su da amfani, amma wurin yana da kyau, hidima tana da kyau kuma zaɓan ba sushi ba yana da kyau.",ma'aikatan,negative
abincin abincin,abincin,positive
"don kusan kuɗi goma sha ɗaya, za ka samu babban abinci mai girma ( ko taco), margarita, da kuma abinci na ƙwaya, amma ma'aikatan suna girman kai kuma abinci bai kai tsawon","taco),",positive
"don kusan kuɗi goma sha ɗaya za ka samu babban abinci mai girma (ko taco), margarita, da abinci na ƙwaya, amma abinci ya yi sanyin gwiwa kuma abinci na teku yana da kyau.",margarita,neutral
"don kusan kuɗi goma sha ɗaya za ka samu babban dabba (ko taco), margarita, da abinci na ƙwaya, amma cin abinci mai kyau ne kuma abincin da ake ci da abinci na vegan yana da yawa.",babban,neutral
"don kusan kuɗi goma sha ɗaya za ka samu babban abinci na abinci mai girma (ko taco), margarita, da kuma abinci na ƙwaya, amma kifi yana da tsawon tsawon lokaci kuma abincin yana da ban sha'awa.",na,positive
"da kyau don cin abinci da sauri, amma suppi na ƙasa ba shi da sauƙi.",cin abinci,positive
"ba ta kama da yawa a waje, amma da zarar ka shiga ciki, yana da wani yanayi dabam; sushi ya fi girma.",ta,positive
"ba ta kama da yawa a waje, amma da zarar ka shiga ciki, yana da wani yanayi dabam; mai daɗi mai daɗi da mai daɗi da mai daɗi.",a waje,negative
"na je gidan common stock don cin abinci kuma na yi farin ciki sosai, amma ba na ɗanɗana abinci.",cin abinci,neutral
"abokina yana cin burger kuma na ci waɗannan pancakes masu ban sha'awa, amma abinci mai kyau ne, ɗanɗano yana cike da kuma yanayi mai kyau.",burger,neutral
"abokina yana cin burger kuma ina cin waɗannan pancakes masu ban sha'awa, amma cin abinci yana da ban sha'awa.",pancakes,positive
"mun yi farin ciki sosai da abincinmu kuma mun yi farin ciki sosai sa'ad da muka ga biyan biyan, amma sushi ya fi ƙarfinmu.",biyan,positive
"mun yi farin ciki sosai da abincinmu kuma mun yi farin ciki sosai sa'ad da muka ga biyan biyan, amma abincin zai ci.",abinci,positive
"suna kawo karusa zuwa teburinka kuma su ba ka har 7 ko 8 na sosin da za ka zaɓa wa steak (na gwada dukansu), amma abincin ya rage tsawon",sosin,neutral
"suna kawo karusa zuwa teburinka kuma su ba ka har 7 ko 8 na sosin da za ka yi wa steak (na gwada dukansu), amma ƙwaƙwalwa tana da kyau.",teburinka,neutral
"suna kawo wa teburinka karusa ta sosi kuma su ba ka har 7 ko 8 na sosin da za ka yi wa steak (na gwada dukansu), amma ɗanɗano mafi muni ne.",teburinka,positive
"suna kawo karusa ta sosi zuwa teburinka kuma su ba ka zaɓi 7 ko 8 na sosin da za ka yi wa steak (na gwada dukansu), amma abincin ƙasar china shi ne mafi kyau, wurin tsabta ne kuma abinci yana da lafiya.",steak,neutral
"hidimar tana da muhimmanci - abin da za ka sa rai daga ritz, amma mai kula da shi ba shi da kyau, mai kula da shi mai rashin hankali ne kuma mai ɗan ziyara mai rashin hankali ne.",abin,positive
"za a mutu da abinci na ƙwaya, amma ba a yi hidima da kyau kuma ba a yi amfani da shi da sauri.",abinci,positive
"cikin nauyin ya yi daidai da na'urar da kake yi a yankinka, amma calamari ne ya yi nasara kuma sa'ar farin ciki tana da sauƙi.",daidai,negative
"an san aikin da ake yi don ya juya baya don ya sa kowa farin ciki, amma mai ba da bar yana da rashin hankali, kifi yana da tsawon tsawon lokaci kuma ba shi da kyau a yi hidima.",aikin,positive
"abinci da ake kira ""roy's classics"" (da ake nuna a cikin abincin da ake ci da asterisks) abinci ne da aka gwada da kuma gaskiya, kamar mahi mahi mahi da aka ƙwace da macadamia, ko kuma ƙanƙara mai daɗi na maraƙi mai daɗi, amma sushi ya fi girma kuma abinci yana da amfani.","""roy's classics""",positive
"abinci da ake kira ""roy's classics"" (a cikin abincin da ake ci da asterisks) abinci ne da aka gwada da kuma gaskiya, kamar mahi mahi mahi da aka yi da macadamia, ko kuma ƙanƙara mai daɗi na nauyin zuma-mustard, amma haske ba shi da kyau, kuki na albarka ƙarya ne kuma waƙa tana da nauyi.","macadamia,",positive
"abinci da ake kira ""roy's classics"" (a cikin abincin da ake ci da asterisks) abinci ne da aka gwada da kuma gaskiya, kamar mahi mahi mahi da aka ƙwace da macadamia, ko kuma ƙanƙara mai daɗi na nauyin zuma-mustard, amma hidima mafi muni ce, biyan biyan ya fi girma kuma cin abinci yana da iko.",abinci,positive
"abinci da ake kira ""roy's classics"" (a cikin abincin da ake ci da asterisks) abinci ne da aka gwada da kuma gaskiya, kamar mahi mahi mahi da aka ƙwace da macadamia, ko kuma ƙanƙara mai daɗi na maraƙi mai daɗi, amma sushi ya fi girma, hidima ba ta da kyau kuma hidima ba ta da kyau.",daɗi,positive
"abinci da ake kira ""roy's classics"" (a cikin abincin da ake ci da asterisks) abinci ne da aka gwada da kuma gaskiya, kamar mahi mahi mahi da aka ƙwace da macadamia, ko kuma ƙanƙara mai daɗi na maraƙi mai daɗi, amma ambiance yana da kyau, ƙanƙara ta albasa ita ce mafi kyau kuma ganyaye suna da bambanci.",abincin,neutral
"abinci da ake kira ""roy's classics"" (a cikin abincin da ake ci da asterisks) abinci ne da aka gwada da kuma gaskiya, kamar mahi mahi mahi da aka ƙwace da macadamia, ko kuma ƙanƙara mai daɗi na nauyin zuma-mustard, amma surubin da aka yi a ƙasa ba shi da sauƙi kuma hidima ta fi muni.",daɗi,positive
"abin da ya fi kyau, tsokolai da tart na mai da ina ɗanɗana ɗan rago kuma ina ɗanɗana ruwan da aka yi.","kyau,",neutral
"abin da ya fi kyau, tsokolai da tart na mai da yin amfani da kujera ba shi da sauƙi kuma hidima tana da ban sha'awa.",amfani,positive
"abin da ya fi kyau, tsokolai da tart na mai da cin abinci yana da ban sha'awa.",tsokolai,positive
"abincin cin abinci yana ba da abinci dabam dabam, har da abinci na teku da kuma manyan steak, akwai wasu abinci da ba na naman ba, amma abincin da ba a da shi ba.","steak,",positive
"abincin cin abinci yana ba da abinci dabam dabam, har da abinci na teku da kuma manyan steak, akwai wasu abinci da ba na naman ba, amma sausage na italiya mai laushi na fennel yana da nauyi, daji ƙauna ce kuma abincin ɗan rago yana da kyau.",ba na naman ba,neutral
"abincin cin abinci yana ba da abinci dabam dabam, har da abinci na teku da kuma manyan steak, akwai wasu abinci da ba na naman ba, amma kujera da ake buɗe ba ta da sauƙi.",abinci na teku,positive
"abincin cin abinci yana ba da abinci dabam dabam, har da abinci na teku da kuma manyan steak, akwai wasu abinci da ba na naman ba, amma ma'aikatan ba su da kyau, kuɗin ba ya da amfani kuma mai ba da abinci ba shi da kyau.",kuɗin,positive
"abincin cin abinci yana ba da abinci dabam dabam, har da abinci na teku da kuma manyan steak, akwai wasu abinci da ba na naman ba, amma abinci ya yi sanyin gwiwa.",abincin,positive
"dukan abu yana da kyau, daga hidima mai kyau na ' yan mata masu kyau, zuwa yanayi mai kyau, amma cin abinci iko ne, wuri mai laushi ne kuma hidima ta bar tana da sauri.",abinci,positive
"dukan abu yana da ban sha'awa, daga hidima mai kyau na ' yan mata masu kyau, zuwa yanayin da ya fi kyau, amma ɗan gidan ba shi da kyau.",' yan mata,positive
"dukan abu yana da kyau, daga hidima mai kyau na ' yan mata masu kyau, zuwa yanayi mai kyau, amma ɗakin yana da sauƙi.",yana,positive
"suna ba da yanayi mai sauƙi, mai sauƙi, amma ma'aikatan jira ba su da sauƙi kuma hidima tana da sauri.",da,positive
"na zo wurin da nake jiran abinci mai kyau, kuma abincin da nake samu shi ne abincin da ake ci a wani manni da ke da sanyi sosai da ba za mu iya jin daɗin cin abinci ba, amma wurin yana da dangantaka na kud da kud.",yi,neutral
"na zo wurin da nake jiran abinci mai kyau, kuma abincin da nake samu shi ne abincin da ake ci a wani manni da ke da sanyi sosai da ba za mu iya jin daɗin cin abinci ba, amma wurin yana da kyau kuma abincin japan yana da kyau.",cin abinci,negative
"na zo wurin da nake jiran abinci mai kyau, kuma abincin da nake samu shi ne abincin da ake ci a wani manni da ke da sanyi sosai da ba za mu iya jin daɗin cin abinci ba, amma cin abinci yana da lafiya.",abinci,negative
"wataƙila ' yar'uwarmu ba ta taɓa ɗanɗana abincin ba, kuma babu wanda zai ba da shawarar yin ruwan inabin, amma hot dogs yana da kyau kuma hidima tana farin ciki.",abinci,neutral
"wataƙila ' yar'uwarmu ba ta taɓa ɗanɗana abincin ba, kuma babu wanda zai ba da shawarar yin ruwan inabin, amma abincin da aka dafa ya yi mamaki.",ruwan inabi,neutral
"wataƙila ' yar'uwarmu ba ta taɓa ɗanɗana abincin ba, kuma babu wanda zai ba da shawarar yin ruwan inabin, amma sandwichi na fara'a suna da ban sha'awa kuma abinci mai kyau ne.",ban,negative
"halibut cheek appetizer ya zo da sashe mai yawa na foie gras, amma wannan shi ne abu kaɗai mai kyau da zan iya faɗa game da abincin; hidima tana da sauƙin hali kuma mai kula da mata yana da alheri.",halibut cheek appetizer,neutral
"halibut cheek appetizer ya zo da sashe mai yawa na foie gras, amma wannan shi ne abu kaɗai mai kyau da zan iya faɗa game da abincin; kujera ba ta da sauƙi, keki na dukiya ƙarya ne kuma sanyi mai cike da zafi ba zai iya cinsa ba.",foie,positive
"abubuwa na al'ada na italiya suna da sauƙi kuma ana ciyar da su a yanayi mai kyau, amma manajan ba shi da kyau, abinci ba shi da kyau kuma ana iya kai shi da hankali.",yi,positive
"abubuwa na al'ada na italiya suna da kuɗi sosai kuma ana yi su a wurin da ake farin ciki, amma hidima ba ta da kyau.",al'ada,positive
"abubuwa na al'ada na italiya suna da sauƙi kuma ana ciyar da su a wurin da ake da kyau, amma casseroles da aka yi da ƙwaƙwalwa ba su da kyau.",italiya,positive
"daidai al dente pasta, ba a nutsar da su da sosi ba - abinci mai yawa, amma hidima ba ta da kyau, hidima tana da sauri sosai kuma hidima tana da ban sha'awa.",amma,positive
"daidai al dente pasta, ba a nutsar da shi da sosi ba - abinci mai yawa, amma hidima ta fi muni.",pasta,positive
"daidai al dente pasta, ba a nutsar da shi da sosi ba - abinci mai yawa, amma sushi shafaffu ne.",sosi,neutral
"mun ji daɗin rayuwarmu sosai kuma za mu koma don cin abinci, amma abincin ba ya daidaita.",abincin,positive
"abin da nake ci da kyau da kuma halitta a chelsea ya ƙunshi abinci na japan na zamani, na yammacin kamar foie gras unagi napolean, steak na jap na hamburger, spaghetti na roe na cod mai laushi, baƙi da miso base, da kuma ɗan rago a cikin sosin truffle baƙi, don a ambata wasu, amma cin abinci yana da kyau kuma hidima tana da kyau.",spaghetti,neutral
"abin da nake ci da kyau da kuma halitta a chelsea ya ƙunshi abinci na japan na zamani, na yamma kamar foie gras unagi napolean, steak na jap na hamburger, spaghetti na roe na cod mai ƙwaya, baƙi da miso base, da kuma ɗan rago a cikin sosin truffle baƙi, don a ambata wasu, amma hidima tana da kyau.",foie gras unagi napolean,neutral
"abin da nake ci da kyau da kuma halitta a chelsea ya ƙunshi abinci na japan na zamani, na yamma kamar foie gras unagi napolean, steak na jap na hamburger, spaghetti na roe na cod mai ƙwaya, baƙi da miso base, da kuma ɗan rago a cikin sosin truffle baƙi, don a ambata wasu, amma hidima tana da kyau, salad yana da kyau kuma yanayin yana da kyau.",cod,neutral
