sentences,aspects,polarities
"hidima tana cikin abubuwan da na taɓa yi a birnin new york, amma ɗakin ba shi da wuya.",new,positive
"abin mamaki ne cewa abincin yana da ban mamaki, amma ba shi da yawa, kuma abincin ba shi da amfani.",amfani.,positive
"kuɗin da ake biyan a bayan mako na manzanni ya yi daɗi sosai, amma sayar tana da tsada sosai, daji ba shi da duhu kuma jira ba shi da kyau.",kuɗi,positive
"masu sayar da bar da shugabannin suna da kyau sosai kuma ado yana da sauƙi kuma yana da sauƙi, duk da haka yana da kyau, amma teburori suna kusa da juna.",shugabannin,positive
"masu sayar da bar da shugabannin suna da kyau sosai kuma ado yana da sauƙi kuma yana da sauƙi, duk da haka yana da kyau, amma kaset mai daɗi ba shi da kyau.",bar,positive
"masu sayar da bar da shugabannin suna da kyau sosai kuma ado yana da sauƙi kuma yana da sauƙi, duk da haka yana da kyau, amma mai ƙwaƙwalwa yana fushi kuma sushi ya fi girma.",ado,positive
"ina son shan giya, esp lychee martini, kuma abincin yana da kyau sosai, amma biyan biyan biyan biyan biyan",shan giya,positive
"ina son shan giya, esp lychee martini, kuma abincin yana da kyau sosai, amma cin abinci yana da ban sha'awa kuma girma yana da yawa.",lychee martini,positive
"ina son shan giya, esp lychee martini, kuma abincin yana da kyau sosai, amma mai ɗan ziyara yana fushi kuma ƙanƙara suna da tsada.",abinci,positive
"sushi yana da tsada da kuma shafaffu, amma shan shanin duhu ne kuma abinci ba shi da sauƙi.",tsada,positive
"sushi yana da tsada da kuma shafaffu, amma tsada yana da tsada, abinci ba shi da sauƙi kuma mai ƙwaƙwalwa yana fushi.",sushi,positive
"yana da kyau a ci abinci na sushi nan da nan, amma keki ba ya dace a tsaya a waje.",sushi,positive
"ba kawai suna da ƙanƙara mafi kyau a garin ba, koyaushe suna ƙoƙarin su kula da ɗanmu, amma abincin ya rage tsawon",kula,positive
"appetizer suna da kyau a nan; za ka iya yin abinci mai kyau daga gare su, amma kuɗin ba ya da amfani kuma sufi na ƙasa ya ƙare.",appetizer,positive
"appetizer suna da kyau a nan; za ka iya yin abinci mai kyau daga gare su, amma keki yana da tsawon tsawon lokaci kuma abincin ba shi da sauƙi.",abinci,positive
"waɗannan ƙanƙanin suna da muhimmanci sosai, amma hot dogs ba su da kyau kuma ba a yi amfani da su a hanyar da ta dace ba.",ƙanƙanin,positive
"ka yi amfani da mojito kuma ka zauna a bayan ɗakin, amma kuɗin ba shi da amfani kuma ɗakin yana da sauƙi.",bayan ɗakin,positive
"ka ci mojito kuma ka zauna a bayan ɗakin, amma mai mulkin ƙarya ne, abinci yana ci kuma abinci yana da ban sha'awa.",mojito,positive
"ko da yake abincin da suke ci a kusantar yana da laushi, sushi da suke yi ba shi da wannan duniyar, amma hidima ba ta da kyau.",abincin,positive
"ko da yake abincin da suke ci a kusantar yana da laushi, sushi da suke yi ba shi da wannan duniyar, amma hidima ba ta da kyau.",sushi,positive
"wannan wurin yana da abinci mafi ban mamaki kuma manzannin suna ƙoƙari sosai su yi abinci mai kyau, amma zaɓan ruwan inabin yana da kyau.",abinci,negative
"wannan wurin yana da abinci mafi ban mamaki kuma manzannin suna ƙoƙari sosai su yi abinci mai kyau, amma salad na king crab da vinaigrette na ' ya'ya mai sha'awa yana da kyau, wuri yana da kyau kuma a kai shi nan da nan.",abinci,negative
"kowace lokaci da na je wurin, ba zan iya zaɓan kome da zan ci ba domin abincin yana cike da abubuwa masu kyau da za a ci, amma burger da aka ƙwace da ƙwaƙwalwa yana da son mutane.",abincin,negative
"ina gaya wa mai ƙwaƙwalwa ya yi wani abu mai ban sha'awa da ya bambanta da abin da ake ci, amma ina son sandwich na ƙanƙara da friji, wannan abincin ne mafi kyau.",abincin,neutral
"ina gaya wa mai ɗan ƙwazo ya yi wani abu mai ban sha'awa da ya bambanta da abin da ake ci, amma abinci yana da kyau, ina ƙoƙarin sufi mai zafi da mai daɗi kuma pizza mai ban mamaki ne.",abinci,neutral
"ko da yake gidan abinci da kansa yana da kyau, na fi son kada in je don cin abinci, amma abinci na teku yana da kyau, hidima mai kyau ce kuma mai da abinci mai iyawa ne.",abinci,negative
"wannan ƙaramin wuri yana da kyau sosai, amma hidima ba ta da sauƙi, hidima ba ta da kyau kuma ma'aikata ba su da kyau.",wuri,positive
"mai gidan da kuma masu hidima suna da kyau kuma suna kula da su, amma cin abinci iko ne kuma hidima tana da ban sha'awa.",abinci,positive
"mai ba da abinci (mai mulki) da savan suna da kyau kuma suna kula da su, amma abinci ba shi da kyau sosai kuma hidima ta bar tana da sauri.",savan,positive
"kuma abincin, abincin zai sa ka dawo, amma manajan ba shi da kyau, haske ba shi da kyau kuma mai ba da abinci yana fushi.",abinci,positive
"kuma abincin, abincin zai sa ka dawo, amma sayar da mutane ba shi da kyau kuma kuɗin ba shi da amfani.",abinci,positive
"suna da dukan irin pasta da aka yi a gida - ina shawarwarin gnocchi - yum, amma masu sayar da bar suna da ban sha'awa, girma yana da shagala kuma idarwa tana da hankali.",pasta da aka yi a gida,positive
"suna da dukan irin pasta da aka yi a gida - ina shawarwarin gnocchi - yum, amma hidima ta yi sanyin gwiwa, wurin yana da sauƙi kuma hidima tana da ɗan jinkiri.",gnocchi,positive
"ƙari ga haka, ƙanƙara da ke da shimi (appetizer) allah ne, amma abinci bai kai tsawon",(appetizer),positive
"mojitos da kuma hidima ne mafi kyau a ciki, amma ƙasa tana da tsawon tsawon lokaci kuma manajan ba shi da kyau.",mojitos,positive
"mojitos da kuma hidimar suna da kyau a wurin, amma abincin ba a ci ba kuma mai ɗan ziyara ya yi fushi da shi.",ziyara,positive
"hidima tana da kyau da kuma atmosfere, amma haske ba shi da kyau, kuma sosin mole yana da daɗi sosai.",sosin,positive
"hidima tana da kyau kuma yanayin yana da kyau, amma ba a yi hidima sosai.",yana,positive
ni da matata mun zaɓi branzini kuma na ga cewa kifin yana da tsawon,kifi,negative
ni da matata mun zaɓi branzini kuma na ga cewa kifin yana da tsawon,branzini,neutral
"abin da ake ci ya yi kyau. , amma disco pop ma'aurata suna da ban sha'awa.",abin,positive
salad na caeser yana da kyau; amma kuɗin yana da tsada kuma mai gidan ya yi ƙarya.,salad na caeser,positive
"calamari da aka dafa ya fi kyau, amma yana da tsawon ciki kuma ba shi da yawa.",calamari,positive
"na yi baƙin ciki sosai da abincin, amma mai ba da abinci yana da kyau kuma ƙanƙara mai daɗi da mai daɗi.",abinci,negative
"banana pudding da suke ba da bai taɓa ganin wutar ba, crabcakes sun fi ruwan gishiri kuma kada ka soma ni a mac da cheese mai mai",mac da cheese,negative
"banana pudding da suke yi ba su taɓa ganin wutar ba, crabcakes sun fi ruwan gishiri kuma ba su soma ni a mac da cheese mai mai mai mai",crabcakes,negative
"banana pudding da suke yi ba su taɓa ganin wutar ba, crabcakes sun fi ruwan gishiri kuma kada ka soma ni a mac da cheese mai mai daɗi, amma ina jin daɗin curry, abinci yana da kyau kuma yana da kyau.",banana pudding,negative
"sushi mai daɗi sosai har ya ƙare a bakinka, amma abinci bai kai tsawon",sushi,positive
"amma ka tabbata cewa kana da isashen wuri a kadin ƙura da kake da shi domin biyan biyan zai sa ka ɓata kuɗin, amma sa'ar farin ciki tana da sauƙi, abinci yana da kyau kuma zaɓan bira yana da kyau.",biyan,negative
abincin ba shi da kyau a yi alheri - ciki ƙaramin ne kuma tsawon,ciki,negative
abincin ba shi da kyau - ciki ƙaramin ne kuma tsawon,abincin,neutral
"abin da ake ci ba shi da kyau, don a yi alheri: ciki ƙaramin ne kuma tsawon amma sushi da yawa ya fi laushi, sraff yana da sauƙi.",abin,negative
abincin ba shi da kyau - ciki ƙaramin ne kuma tsawon,abinci,negative
"abin da kake ci yana da tsada sosai, amma keki ba shi da sauƙi.",keki,negative
"dole ne a mai da steak na delmonico na $72 domin ba a daka shi don a zaɓe shi ba, amma ina shawarwarin daji na ƙanƙara/na maraƙi.",steak na delmonico,negative
"hukumar ba ta yin amfani da shi ba, amma yanayin yana da kyau kuma ana iya cire nodoli na sesame mai sanyi.",hukumar,negative
"koyaushe mun samu hidima mai ban mamaki kuma muna son abincin, amma mai ƙwaƙwalwa rashin hankali ne kuma masu sauƙin kai suna da baki mai ƙarfi.",samu,positive
"mun ci gaba da samun hidima mai ban mamaki kuma muna son abincin, amma mai barin ba shi da kyau.",abinci,positive
"na ci abinci mai kyau na japan a wani wurin cin abinci, amma kafa ya fi kyau.",japan,negative
"da farko, yin tafiya a wurin yana da yanayi mai kyau, amma keki yana da tsawon tsawon lokaci, ana yin amfani da shi da hankali kuma ana yin hidima mai ban sha'awa.",amfani,positive
"da farko, yin tafiya a wurin yana da yanayi mai kyau, amma ɗakin ba shi da wuya kuma hidima ba ta da kyau.",wurin,positive
"amma abincin yana da ban sha'awa, amma abinci mai kyau ne kuma ana so abincin da ake ci a gidan mcdonald's.",abinci,negative
"na zaɓi daji teriyaki kuma mijina ya sami garlic shrimp, amma ƙanƙara da ƙanƙara tana da kyau kuma hidima ta fi girma.",hidima,neutral
"na zaɓi chicken teriyaki kuma mijina ya samu garlic shrimp, amma pasta na musamman yana da ban mamaki, salad na eggplant yana da kyau kuma sushi ya fi kyau.",chicken teriyaki,neutral
"an ƙone shi gabaki ɗaya kuma a gefen sanyi kuma sosin ba shi da laushi sosai, amma ɗanɗano yana mamaki, yanayin yana da kyau kuma zaɓen ruwan inabin (ainihi na sifanisanci) yana da ban sha'awa.",sosin,negative
"an ƙone shi gabaki ɗaya kuma a gefen sanyi kuma sosin ba shi da laushi sosai, amma wurin cin abinci a waje ƙaramin ne kuma fukafukansa suna da kyau.",kuma,negative
"abubuwa guda masu kyau da zan iya faɗa shi ne cewa hidimar tana nan da nan, mun zauna nan da nan kuma server yana da sauƙin hali, amma cin abinci yana da tsada.",server,positive
"abubuwa guda masu kyau da zan iya faɗa shi ne cewa hidimar tana da gaggawa, mun zauna nan da nan kuma server yana da abokantaka sosai, amma mutane ba su da kyau kuma cin abinci ya fi muni.",zauna,positive
"ana yawan kuɗi don irin wannan abinci mai ban sha'awa, amma abinci ba shi da tsada sosai, abinci yana da ban sha'awa kuma hidima tana da kyau.",abinci,negative
"na samu labari mai kyau a trio ... ma'aikata sun yi farin ciki. abinci mai laushi ne kuma ya fi girma - na shawarce shi sosai portobello/gorgonzola/sausage appetizer da lobster azi, amma kuɗin yana da tsada, kuɗin ya fi tsada kuma shugabancin ba shi da sauƙi fiye da abin da ake so.",lobster,positive
"na samu labari mai kyau a trio ... ma'aikata sun yi farin ciki. abinci mai laushi ne kuma ya fi girma - zan ba da shawara sosai cewa portobello/gorgonzola/sausage appetizer da lobster, amma jerin ruwan inabin ba shi da sauƙi kuma hidima ba ta da kyau.",abinci,positive
"na samu labari mai kyau a trio ... ma'aikata sun yi farin ciki. abinci mai laushi ne kuma ya fi girma a girma - na ƙarfafa portobello/gorgonzola/sausage appetizer da lobster, amma mai kula da abinci ba shi da kyau kuma abinci ba shi da kyau.",portobello/gorgonzola/sausage appetizer,positive
"na samu labari mai kyau a trio ... ma'aikata sun yi farin ciki. abinci mai laushi ne kuma ya fi girma - zan ba da shawara sosai cewa portobello/gorgonzola/sausage appetizer da lobster akasin haka, amma abinci ba ya daidaita.",ma'aikata,positive
"na samu labari mai kyau a trio ... ma'aikata sun yi farin ciki. abinci mai laushi ne kuma ya fi girma - zan ba da shawara sosai cewa portobello/gorgonzola/sausage appetizer da lobster azi, amma kuɗin ba shi da amfani kuma hidima tana da ɗan lokaci.",girma,positive
"wannan hidimar tana mai da hankali sosai kuma tana da karimci sosai, amma ' yar'uwar tana da rashin hankali, sosai na italiya mai laushi na fennel yana da nauyi kuma shan giya yana da ban sha'awa.",wannan,positive
"mun ci abinci mai kyau da ruwan inabin da kuma abinci mai daɗi, amma abinci mai kyau ne.",ruwan inabi,positive
"mun ci abinci mai kyau, ruwan inabin, da kuma abinci na ƙwaya, amma mun yi sanyin gwiwa.",abinci na ƙwaya,positive
"mun ci abinci mai kyau, ruwan inabin, da abinci na ƙwaya, amma sosin mole mai daɗi ne, jerin ruwan inabi yana sa baƙin ciki kuma hot dogs mafi muni.",abinci,positive
"abin cin abinci mai kyau ne a tsakiyar tsakiyar gari mai yawa, amma ɗanɗano ba shi da wuya, mai ɗan",abinci,positive
"koyaushe ana yin hidima mai kyau, kuma mai gidan yana tafiya don ya tabbata cewa kana jin daɗin yin hakan, amma kuɗin yana da tsada sosai.",mai,positive
"koyaushe ana yin hidima mai kyau, kuma mai gidan yana tafiya don ya tabbata cewa kana jin daɗin yin hakan, amma abincin yana da tsada sosai kuma casseroles da aka yi da ƙwaƙwalwa suna da tsanani.",abincin,positive
"mun zauna kusa da ƙasa, amma hidima tana da kyau.","ƙasa,",neutral
"waƙar tana da ban sha'awa, amma ta bar wurin tattaunawa, kuma mai barin ya sha abinci mai kyau; sabis ɗin yana da sauri sosai kuma kukis masu arziki suna da ban sha'awa.",abinci,positive
"waƙar tana da ban sha'awa, amma ta bar wurin tattaunawa, kuma mai barin ya sha abinci mai kyau; casseroles na curried yana da tsanani.",bar,positive
"waƙar tana da ban sha'awa, amma ta bar wurin tattaunawa, kuma mai barin ya sha abinci mai kyau; mutane suna da mugun sakamako, keki na dukiya ƙarya ne kuma abinci yana sa baƙin ciki.",waƙar,positive
"abin da ake ci ba shi da kyau sosai kuma hidima tana da ban sha'awa, amma kuɗin yana da kyau, tamani yana da kyau kuma ina ƙoƙarin calamari.",abin,negative
"abin da ake ci ba shi da kyau sosai kuma hidima tana da ban sha'awa, amma abincin india yana da tsanani, hot dogs ne mafi kyau kuma hidima tana da kyau.",abinci,negative
"ina farin ciki cewa na yi hakan domin abincin yana da kyau sosai kuma ma'aikatan suna da aminci, suna da ladabi da kuma aiki mai kyau, amma masu ƙwazo suna fushi, abincin ƙaramin ne kuma abincin yana da wuya.",ma'aikata,positive
"ina farin ciki cewa na yi hakan domin abincin yana da kyau sosai kuma ma'aikatan suna da aminci, suna da ladabi da kuma aiki mai kyau, amma keki yana da tsawon tsawon lokaci kuma ɗan gidan ba shi da kyau.",abinci,positive
"ban taɓa cin abinci marar kyau ba (ko kuma hidima marar kyau) @ pigalle, amma cin abinci mafi muni ne.",abinci,positive
"ban taɓa cin abinci marar kyau ba (ko kuma hidima marar kyau)@ pigalle, amma teburori suna kusa da juna sosai.",cin abinci,positive
"wannan ya sa ya kasance da bayyane cewa abincin ba a dafa shi ba; a bayyane yake cewa an yi shi kafin hannu kuma aka sake ɗumi, amma ina gwada ƙwaƙwalwa, ɗanɗano yana mamaki sosai kuma abinci yana da kyau.",abinci,negative
"a lokacin da ake yawan aiki, ina ƙarfafa ka ka yi ƙoƙari ka yi ƙoƙari, amma hidima tana da kyau, kafa yana da kyau kuma ma'aikata suna da aminci.",yi,neutral
"amma mac cheese su ne yummy. hidima tana da ban sha'awa, manajan rashin hankali ne kuma abinci ba shi da tsawon",mac cheese,positive
"abin da suke ci a lokacin cin abinci yana da amfani ga kowa, amma jerin ruwan inabin yana sa baƙin ciki kuma ɗan gidan ba shi da kyau.",abinci,positive
"waƙar jazz tana da murya mai kyau + ta sa dukanmu mu tashi mu rawa don mu ƙara cin abinci, amma hidima ba ta da kyau.",jazz,positive
"idan kana neman abinci mai tsada da ke da ɗan ƙasa mai tsada bx a$$ wannan wurin ne da za ka kasance, amma abinci yana da kyau, yanayin cin abinci yana da kyau kuma shan shanin yana da ƙauna.",yanayin,negative
"idan kana neman abinci mai tsada da ke da ɗan ƙasa mai rashin kuɗi bx a$$ wannan wurin ne da za ka kasance, amma abincin da ake ci yana da sauƙi kuma sufi yana da zafi.",abinci,negative
"idan kana neman abinci mai tsada da ɗan ƙasa mai tsada bx a$$ wannan wurin ne da za ka kasance, amma yanayin yana da kyau kuma mcdonald's famous french fries shi ne wanda ake so.",tsada,negative
"sabis ɗin yana da sauƙi, amma hot dogs ne mafi muni kuma menu ne kananan.",sabis,positive
"mun haɗu da wannan gidan abinci ba zato ba sa'ad da muke bikin zane - zane na dumbo kuma mun ji daɗin cin abincinmu, amma ɗan'uwanmu mai rashin hankali ne kuma waƙa tana da nauyi sosai.",cin abinci,positive
"abin da ake ci a italiya yana da kyau sosai, amma sausage na italiya mai laushi na fennel yana da nauyi kuma cin abinci ba shi da kyau.",italiya,positive
"abin da ake ci na italiya yana da kyau sosai, amma keki ba shi da kyau a tsaya a waje, sosin mole yana da daɗi sosai kuma mai daɗi yana da girma.",abin,positive
"wannan hidimar ta fi kyau, amma shan giya yana da ban sha'awa kuma ma'aurata biyu na disco pop suna da ban sha'awa.",sha'awa,positive
"ban san abin da wasu mutane da suke farin ciki game da wannan hot dog suke magana game da shi ba, amma sandwichi suna da kyau.",hot dog,negative
"wannan ba tare da tambaya ba shine daya daga cikin mafi kyawun hotdogs da na taɓa samu, amma ruwan inabi yana da kyau kuma pizza shine mafi kyau.",hotdogs,negative
"ƙari ga manyan karnuka masu zafi, dotp yana da sandwichi masu kyau na fara'a da ke da amfani, ƙari ga abubuwa masu girma kamar tator tots da muffins na ingila, abinci mai laushi na ɓarayi da ke nj ya san mu mata da yara na jersey a matsayin ham na taylor, amma cin abinci yana da iko.",muffins,positive
"ƙari ga manyan hot dogs, dotp yana da sandwichi masu kyau na fara'a da ke da amfani, ƙari ga abubuwa masu girma kamar tator tots da muffins na ingila, abinci mai laushi na ɓarayi da ke nj ya san mu matan jersey da yara kamar taylor ham, amma shan shanin duhu ne, ɗaki yana da sauƙi kuma hidima tana da sauri.",taylor ham,positive
"ƙari ga manyan hot dogs, dotp yana da sandwichi masu kyau na fara'a da ke da amfani, ƙari ga abubuwa masu girma kamar tator tots da muffins na ingila, abinci mai laushi na ɓarayi da ke nj ya san mu matan jersey da yara kamar taylor ham, amma abinci ba shi da amfani kuma keki ba ya da amfani a tsaye a waje.",ɓarayi,positive
"ƙari ga manyan hot dogs, dotp yana da sandwichi masu kyau na fara'a da ke da amfani, ƙari ga abubuwa masu girma kamar tator tots da muffins na ingila, abinci mai laushi na ɓarayi da ke nj ya san mu mata da yara na jersey a matsayin ham na taylor, amma haske ba shi da kyau kuma abinci yana da ban sha'awa.",tator tots,positive
"ƙari ga manyan hot dogs, dotp yana da sandwichi masu kyau na fara'a da ke da amfani, ƙari ga abubuwa masu girma kamar tator tots da muffins na ingila, abinci mai laushi na ɓarayi da ke nj ya san mu mata da yara na jersey a matsayin taylor ham, amma abinci ya yi sanyin gwiwa.",hot dogs,positive
"ƙari ga manyan hot dogs, dotp yana da sandwichi na fara'a masu ban sha'awa da ke da amfani, ƙari ga abubuwa masu girma kamar tator tots da muffins na ingila, abinci mai laushi na ɓarayi da ke nj ya san mu mata da yara na jersey a matsayin ham na taylor, amma hidima mafi muni, tsada yana da tsada kuma ɗan'uwa mai ɗan",sandwichi,positive
"kalaman game da abinci da aka dafa daidai ne (a ƙasa) amma sauran abincin, har da abincin ɗan rago da kuma salad (shimi na avocado) sun yi kyau; malted milk ball yana da ban sha'awa, abincin indiya yana da muhimmanci kuma french fries yana da kyau.",abinci da aka dafa,negative
"kalaman game da abinci da aka dafa daidai ne (a ƙasa) amma sauran abincin, har da abincin ɗan rago da kuma salad (shimi na avocado) sun yi kyau; hidima tana da ban sha'awa, abinci yana da kyau kuma mai mulkin ƙarya ne.",salad (shimi na avocado),positive
"kalaman game da abinci da aka dafa daidai ne (a ƙasa) amma sauran abincin, har da abincin ɗan rago da kuma salad (shimi na avocado) sun yi kyau; abinci ba shi da daraja kuma a cikin gida yana da tsada.",abinci,positive
"kalaman game da abinci da aka dafa daidai ne (a ƙasa) amma sauran abincin, har da abincin ɗan rago da kuma salad (shimi na avocado) sun yi kyau; menu yana da ƙananan.",abincin,positive
"jerin ruwan inabin da ba shi da sauƙi (sabuwar ruwan inabin ne kawai, amma zaɓe yana da kyau.",zaɓe,negative
"jerin ruwan inabin da ke sa baƙin ciki (sabuwar ruwan inabin ne kawai, amma ruwan inabin yana da kyau, ciyawa mai daɗi yana da yawa kuma abincin yana da ban sha'awa.",jerin ruwan inabi,negative
"amma ga darajar, wurin ya fi kyau don jin daɗin dare tare da ƙananan rukuni; hidima ba ta da kyau.",wurin,positive
"mai ɗan ziyara yana da amfani kuma yana da kyau, abincin yana da kyau, kuma ruwan inabin yana da kyau, amma keki ba ya dace a tsaya a waje.",ruwan inabi,positive
"mai ziyararmu yana da amfani kuma yana da kyau, abincin yana da kyau, kuma ruwan inabin yana da kyau, amma ba shi da kyau.",abincin,positive
"mai ziyararmu yana da taimako kuma yana da kyau, abincin yana da kyau, kuma ruwan inabin yana da kyau, amma inabi ba shi da duhu, hidima tana da ban sha'awa kuma masu ba da abinci ba su da kyau.",abinci,positive
"abin da ake ci ya fi kyau kuma abincin ya fi kyau, amma abincin yana da ban sha'awa, sosin mole yana da daɗi sosai kuma sushi ya fi girma.",sosin,positive
"abin da ake ci ya fi kyau kuma ana ba da abinci sosai, amma ba a yi amfani da shi da sauri.",abinci,positive
"ka manne wa abubuwa da wurin yake yi mafi kyau, ƙwaƙwalwa, ƙwaƙwalwa, fukafukan, cajun shimi mai kyau ne, ba mai kyau ba, amma abinci na teku yana da shafaffu, hidima tana da kyau kuma cin abinci mafi muni.",cajun shimi,neutral
"ka manne wa abubuwa da wurin yake yi mafi kyau, ƙwaƙwalwa, ƙwaƙwalwa, fukafukan, cajun shimi mai kyau ne, ba mai girma ba, amma hidima tana da ban sha'awa, hidima tana da ban sha'awa kuma tsada yana da tsada.",da,positive
"ka manne wa abubuwan da wurin yake yi da kyau, ƙwaƙwalwa, ƙwaƙwalwa, fukafukan, ƙanƙara mai kyau, ba mai kyau ba, amma cin abinci mafi muni ne.",yi,positive
"ka manne wa abubuwan da wurin yake yi da kyau, ƙwaƙwalwa, ƙwaƙwalwa, fukafukan, cajun shimi mai kyau ne, ba mai girma ba, amma nauyin lobster na ƙerawa na ƙerawa ne.",yi,positive
"za a iya zaɓan bira mai kyau, kamar bira 50, amma wurin yana da tsabta, sa'a mai farin ciki tana da sauƙi kuma yanayin yana da sauƙi.",bira,neutral
"za a iya zaɓan bira mai kyau, kamar bira 50, amma ' yar'uwar ba ta da hankali kuma ba ta yin hidima da sauri.",zaɓan,positive
"btw, sabis ne mai kyau sosai, amma abinci ba shi da daraja.",sabis,positive
"saboda haka, mun zauna a barin, mai ba da barin ba ya son ya kasance a wurin, domin gidan ba shi da kyau.",bar,neutral
"saboda haka mun zauna a barin, mai barin ba ya son ya kasance a wurin, amma yanayin yana da kyau, abinci yana da kyau kuma sangria yana da kyau.",bar,negative
"ba mu san ko ya kamata mu zaɓi abinci ko mu bar shi ba, amma cin abinci yana da ban sha'awa kuma hidima tana da kyau.",sha,neutral
"mun yi mamaki me ya sa suka kasance a wurin don su sa mu yi baƙin ciki a cin abinci, amma ana yin hidima nan da nan kuma ana so manyan mac.","abinci,",negative
"duk da haka, mai gidan ƙarya ne, amma kuɗin ya dace, salad na eggplant yana da kyau kuma abinci yana da kyau.",mai,negative
"a gaskiya, abincin ƙasar china a nan abin da zan iya kyautata a gida, amma cin abinci ba shi da kuɗi, wuri yana da tsabta kuma ma'aikatan suna da kyau.",china,negative
"akwai mai ɗan ziyara ɗaya kawai a dukan gidan abinci a saman, amma ana mai da hankali ga hidima kuma bar yana da ban sha'awa.",abinci,neutral
"na ɗauka cewa abincin ba shi da sauƙi idan aka gwada da chinatown, amma ma'aikatan suna da aminci, sufi mai ban mamaki ne kuma abincin yamma yana da kyau.",abinci,negative
"chinatown babu shakka tana da kyau da kuɗin kuɗi, amma hidima tana da sauri sosai, sau da yawa ba ta da kyau kuma sashen ba shi da yawa.",kuɗin,positive
"chinatown babu shakka tana da kyau da kuɗin kuɗi, amma masu sayar da bar suna da ban sha'awa kuma kuɗin ba shi da amfani.",kyau,positive
"na fahimci kuɗin idan yana ba da abinci mai kyau, kamar wasu manzanai na ƙasar china a tsakiyar gari/a yankin uptown, amma ana mai da hankali ga hidima.",kuɗin,negative
"na fahimci kuɗin idan ya ba da abinci mai kyau, kamar wasu manzanai na ƙasar china a tsakiyar gari/a yankin uptown, amma ina shawarwarin daji na ɓarayi, keki mai sauƙi ne kuma martinis ba shi da kyau.",abinci,negative
"ana cinsa da inabi baƙi da kuma jingar da aka yanke, amma abinci yana da zafi, ƙanƙara mai laushi yana da muhimmanci kuma calamari ya yi nasara.",cinsa,neutral
"ana cinsa da inabi baƙi da kuma jingar da aka yanke, amma tsuntsaye masu koyarwa suna da kyau kuma abinci yana da kyau.",jingar da aka yanke,neutral
"malted milk ball gelato - ka taɓa jin wani abu mai ban sha'awa a rayuwarka, amma sanyi mai cike da zafi ba abin cin ba ne.",malted milk ball gelato,positive
"na ga cewa abincin yana da kyau kamar mai mulkinsa, da silvano, wanda ba shi da tsada sosai, amma abincin ba shi da tsada, abincin ya rage tsawon",mai,positive
"na ga cewa abincin yana da kyau kamar wanda yake da shi, da silvano, amma ba shi da tsada sosai, amma cin abinci ba shi da kyau.",abinci,positive
"yanayin yana da sauƙi kuma yana da sauƙi, amma ɗanɗano ba shi da wuya kuma ɗakin yana da sauƙi.",ba,positive
"abin da ake ci da abinci da kuma pasta da yawa suna da ban mamaki, amma manajan ba shi da kyau.",pasta,positive
"abin da ake ci da abinci da kuma pasta da yawa suna da ban mamaki, amma mai ba da abinci ba shi da kyau, hidima ba ta da kyau kuma yin amfani da shi ba shi da sauƙi.",abinci,positive
"hakika, ka gwada taglierini da truffle - abin ban mamaki ne, amma hidima tana da sauri.",taglierini da truffle,positive
"ƙari ga haka, ma'aikatan suna mai da hankali sosai kuma suna da sauƙin hali, amma biyan",ma'aikata,positive
"an ƙona abincin da nake da shi, kuma an ƙona shi da ɗan ƙonawa, amma pizza ce mafi kyau, sufi yana da ban mamaki kuma salad mai laushi ne.",an,negative
"an ƙona ciyawata, kuma an ƙona ta da ɗan ƙonawa, amma abincin rana yana da kyau, abinci mai kyau ne kuma abinci mai kyau ne.","ƙonawa,",negative
"suna da hidima mai sauƙi da ke da kyau idan ba ka da lokaci mai yawa, amma ma'aurata na disco pop suna da ban sha'awa kuma ɗanɗano mafi muni ne.",sha'awa,positive
"a'a, buƙatar abinci ta fi ƙarfin nan. fara'a foooutd, soups, salad, sandwich, da sauransu, amma wurin yana da kyau, kifi mai baƙi da aka ƙwace yana da ban sha'awa kuma shan abinci mai laushi ne.",abinci,neutral
