sentences,aspects,polarities
"qolku waa caraf yar, laakin way adagtahay in meel yar oo caynkaas ah la sameeyo mid xiiso leh, mana soo jeedin doono in ay tahay sabab aanan u tagin; maratha waa cusub tahay.",in,negative
"qolku waa caraf yar, laakin way adagtahay in meel yar oo caynkaas ah la sameeyo mid xiiso leh, mana soo jeedin doono in ay tahay sabab aanan u tagin; casho waa fiican oo saketini waa cajiib ah.",meel,negative
"casho aad u qurux badan ku lahaa isku xidhkan cuntada badda ee u heelan, cuntadana si fiican loo soo diyaariyay loona soo bandhigay adeeguna wuxuu ahaa mid wacan oo degdeg ah, laakiin raashinku waa qaali, shaqaalaha waa isla weyna iyo adeegga baarku waa mid gaabis ah.",adeeguna,positive
"casho aad u qurux badan ku lahaa isku xidhkan cuntada badda ee u heelan, cuntada ayaa si fiican loo diyaariyay loona soo bandhigay adeegguna wuxuu ahaa mid wacan oo degdeg ah, laakiin qaboojiyaha cagaaran lama cuni karo, xanuunka hodanka ah waa mid aan xushmad lahayn digaagguna waa mugdi.",cuntada,positive
"casho qurux badan oo ku jirta isku xidhkan cuntada badda ee u heelan, cuntada ayaa si fiican loo diyaariyey oo loo soo bandhigay adeegguna wuxuu ahaa mid wacan oo degdeg ah, laakiin sugiddu waa mid aan fiicnayn, qabow cagaaran ma aha mid la cuni karo oo size ayaa mashquul ah.",casho,positive
"meel a fiican, ilaa iyo inta aanu helin aad u buuxsamay iyo cibaadada halminded in ay cuntada la doortay ka dhigi mare doorasho weyn oo loogu talagalay dadka ku caashaqi jiray cuntada badda, laakiin qolka waa caraabaah iyo cake waa celcelis ahaan.",cuntada,positive
"meel a fiican, ilaa iyo inta aysan helin aad u buuxdhaafeen iyo cibaadada halminded in ay cuntada la doortay ka dhigi mare doorasho weyn oo loogu talagalay dadka ku caashaqi jiray cuntada badda, laakiin music waa mid aad u culus, milkiilaha waa been abuur ah oo suugo jilicsan waa mid aad u macaan.","badda,",positive
"iyada oo dhan meelaha mundane ama mediocre on 8th avenue waa wax fiican in ay leeyihiin mid ka mid ah in ay tahay talaabo kor ku xusan in quaility iyo jawiga, laakiin diskko duo pop waa mid aad u xun iyo gudaha celcelis ahaan.",quaility,positive
"iyada oo dhan meelaha mundane ama mediocre on 8th avenue waxaa fiican in ay leeyihiin mid ka mid ah in ay tahay talaabo kor ku xusan in quaility iyo jawiga, laakiin meel waa dhadhan, sugitaanka waa xushmad iyo milkiilaha waa been abuur ah.",jawiga,positive
"haddii aad jeceshahay cuntada badda iyo / ama cuntada greek aad jeclaan doonaa meeshan in kastoo aysan ku koobnayn oo kaliya waxyaalahan oo kaliya, laakiin adeega waa mid laga cabsado.",badda,positive
"haddii aad jeceshahay cuntada badda iyo / ama cuntada greek aad jeclaan doonaa meeshan in kastoo aysan ku koobnayn oo kaliya waxyaabahan, laakiin cuntada waa fancy, fanaaniinta xun iyo qaybo yar yahay.",cuntada,positive
"raashinku wuxuu ahaa ku dhowaad mar walba excellent, laakiin kuwa wax faqaan ah waa xun, baararka waa xushmad iyo jeelasha waa xushmad.",raashinku,positive
"my jecel halkan waa pastor tacos ah iyo tostada de tinga ah, laakiin casseroles curried waa adag.",tacos,positive
"my jecel halkan yihiin pastor tacos ah iyo tostada de tinga ah, laakiin cuntada japanese waa ka wanaagsan.",tostada de tinga,positive
"qurxinta waa tii markii hore i heshay albaabka, laakiin menu waa yar yahay.",qurxinta,positive
"baradhada qaro weyn leh, suugo hilib leh iyo baradho la dubay oo cufan oo la dubay ayaa soo baxaya menu oo ay ku jiraan qabow qabow, shukulaatada aalladda qaro weyn, laakiin cuntada waa cajiib, duubku waa mid aad u fiican iyo meel la jecel yahay.",dubay,neutral
"baradhada qarada waaweyn, suugo hilib leh iyo baradho la dubay oo cufan oo la dubay ayaa soo baxaya menu oo ay ku jiraan qabow, shukulaatada aalladda qaro weyn ee qabow, laakiin sanboorka quraacdu waa mid cajiib ah iyo sushi waa cusub.",shukulaatada,neutral
"barafada oo qaro weyn, bulaacada hilibka leh iyo baradho la dubay oo la buuxiyay ayaa soo baxaya menu oo ay ku jiraan qabow, shukulaatada aalladda qaro weyn oo qabow, laakiin adeegga baarku waa mid gaabis ah oo sugaha waa xushmad la'aan.",shukulaatada,positive
"baradhada qarada waaweyn, suugo hilib leh iyo baradho la dubay oo la dubay oo la buuxiyay ayaa soo saaray menu oo ay ku jiraan qabow, shukulaatada aalladda qaro weyn leh ee qabow, laakiin qiimaha wuu weyn yahay iyo sushi waa cusub yahay.",menu,neutral
"baradhada oo qaro weyn leh, bulaacada hilibka leh iyo baradho la dubay oo la buuxiyay ayaa soo wareegaya menu oo ay ku jiraan qabow, qabow shukulaatada oo aad u qaro weyn, laakiin adeegu waa mid fiiro gaar ah leh oo cuntada talyaanigu waa mid fudud.",gaar,neutral
"waa in aan dhaho waxay leeyihiin mid ka mid ah waqtiyada dhalmada ugu dhaqsiyaha badan ee magaalada dhexdeeda, laakiin hoygu waa xushmad daro.",waqtiyada,positive
"mar walba cuntada waa mid cusub oo kulul- diyaar u ah in la cuno, laakiin shaqaalaha ayaa ah kuwa kibirsan.",cuntada,positive
"coffee waa heshiis ka wanaagsan yahay naas-nuujinta cosi ee aadka loo dulmaray, laakiin waayo-aragnimada cuntada ayaa ugu xun.",coffee,positive
"coffee waa heshiis ka fiican sanbabka cosi ee aadka loo dulmariyay, laakin shaaha waa weyn.",cosi,negative
"waxaan u tegi lahaa oo kaliya kafeega taas oo ah hab ka fiican starbucks ama wixii la mid ah, laakiin sugayaashu way xun yihiin, sugiddu waa xushmad daro iyo qaboojiyaha cagaaran ma aha la cuni karo.",kafee,positive
"haddii aad raadinayso cunto dhab ah oo hong kong ah, ha sii fiirin, laakiin shaqaalaha ayaa xun.",hong,positive
"suxuunta bariiska iyo suxuunta marada lagu furo mariya maraakiibta yar waxay ka badan yihiin $5 waxaana lagu daraa cabitaan baraf ah oo qaboojinaya $2 waxaana laguu qeexayaa habeenkii, laakiin qaybo yar ayaa jira.",cabitaan,positive
"suxuunta bariiska iyo suxuunta marooyinka marada ah naar ahaan waxay ka badan yihiin $5 waxaana lagu daraa on cabitaanka barafka qaboojinta $ 2 oo aad ku socoto habeenkii, laakiin adeegga waa mid aan xushmad lahayn, smoothies waa weyn oo saxan waa la cuni karo.",suxuunta bariiska,positive
"suxuunta bariiska iyo suxuunta marada lagu furo mariyaduna ma aha in ay ka badan yihiin $5 waxaana lagu daraa $2 cabitaan baraf oo qaboojinaya waxaana laguu qeexayaa habeenkii, laakiin xabadaha ayaa qaali ah.",suxuunta,positive
"nasiib darro, waxaan u doortay meeshan qadada sida aan ku samaynay socod badan oo ku dhamaaday south st seaport, laakiin xulashada khamriga (ugu horrayn isbaanish) waa mid xiiso leh iyo qaab-dhismeedka waa marmar.",socod,neutral
"no beans cagaaran, ukun lahayn, labiska anchovy, ma nicoise saytuunka, oo aan lahayn salootin, oo aan lahayn salal cas, laakiin duudduuban oo leh duudduuban oo xabo waa weyn yahay.",labiska,neutral
"no doans cagaaran, ukunta ma, ma labiska anchovy, ma nicoise saytuun, ma buskuul cas, laakiin menu waa kala duwan yahay, dhadhan waa gaaban iyo adeeg waa saaxiibtinimo.",nicoise,neutral
"no beans cagaaran, ukunta ma, labiska anchovy, ma nicoise saytuunka, ma buskud cas, laakiin kafeega ayaa ka fiican, odessa stew waa fiican yahay iyo rooti quraacdu waa cajiib.",ukun,neutral
"digirta cagaaran ma leh, ukun ma leh, labiska labiska labiska, nicoise ma leh saytuun, ma jiro oo maqnasuun cas, laakiin cuntadu way wanaagsan tahay.",cagaaran,neutral
"no digir cagaaran, ukunta ma, ma labiska anchovy, ma nicoise saytuunka, ma bushahay gaduudan, laakiin meesha waa cajiib ah soo dhaweyn diiran, digaag waa weyn iyo waayo-aragnimo cuntada waa ugu xun.","anchovy,",neutral
"dhab ahaantii, tani ma ahayn salad nicoise ah oo si dhib yar loo cuni karo, laakiin sushi ayaa ugu fiican.",salad,negative
"marwada nasiib darrada ah ee nagu xiga waxay u malaynaysay in ay dalbatay salad (oo ay kujirto weydiisanaya dharka salad) oo waxaa halkii la siiyey quesedilla ah, laakiin qiimaha waa macquul, tayada waa ka fiican tahay iyo xulashada biirka waa weyn yahay.",salad,neutral
"gabadha nasiib darrada ah ee nagu xiga waxay u malaynaysay in ay dalbatay salaad (oo ay ku jirto dalbashada salad labis) waxaana halkii la siiyey kabaha quesedilla, laakiin suxuuntu waa dhadhan badan tahay, waayo aragnimada cuntada waa mid qurxoon iyo shaqaaluhu wuu fiican yahay.",quesedilla,neutral
"gabadha nasiib darrada ah ee nagu xigay waxay u malaynaysay in ay dalbatay salaad (oo ay ku jirto dalbashada salaad labis) waxaana meeshii la siiyey kaddib quesedilla, laakiin cuntadu waa wayntahay shaqaaluhuna waa aqoon.",salaad,neutral
"markay cabanaysay, midiidintii ayaa tidhi, waan tacsiyayn, laakin cuntadu waa fiicantahay, cabitaankuna aad buu u xun yahay.",cuntadu,neutral
"15% gratuity si toos ah ayaa lagu daray biilka, laakiin cuntada talyaanigu waa cusub yahay.",gratuity,negative
"15% gratuity si toos ah ku daray biilka, laakiin cuntada waa weyn.","biilka,",negative
"cake raspberry shukulaatada waa jannada- ma aha mid aad u macaan, laakiin dhadhan ka buuxa, adeega adeegu aad ayey u yartahay, cuntaduna waa mid aan is khilaafsaneyn.",dhadhan,positive
"cake raspberry shukulaatada waa jannada- ma aha mid aad u macaan, laakiin dhadhan ka buuxa, saxan waa la cuni karo, dhadhanka waa gaaban yahay, adeeguna waa mid gaabis ah.",cake,positive
"kursigaas middood kursi raaxo leh middood ku fadhiiso, shaqaalahuse waa kibir badan yahay.",kibir,positive
"jawiga ayaa laguu geynayaa meeshaas, meeshaasna riyadii badan baa ku qotoma, laakiin raashinku ma qiimeeyo adeeguna waa mid gaabis ah.",jawiga,positive
"haddii aad doorato mocha qashinka leh ama mocha cad cad kulul aad hubto in aad tahay mid aad u faraxsan, laakiin qaybo waa yar oo cookies fortune waa cabasho.",mocha,positive
"haddii aad doorato mocha qafiif ah isku daray ama mocha cad kulul aad ayaad hubi in aad u aad u faraxsanahay, laakiin cookies fortune waa cabasho ah, adeega waa mid aad u xun iyo bartenders waa mid aad u xun.",mocha,positive
"inkastoo ay jirto menu hufan, waa in aanay qaadan toban daqiiqo si aad u hesho cabitaankaaga iyo 45 for pizza macmacaan, laakiin maraqku waa kulul yahay, smoothies waa weyn yahay iyo cuntada ugu xun.",cabitaan,neutral
"inkastoo ay jirto menu hufan, waa inaysan qaadan toban daqiiqo si aad u hesho cabitaankaaga iyo 45 pizza macmacaan, laakiin xanuun-huhu waa xushmad la'aan.",menu,positive
"inkastoo ay jirto menu hufan, waa inaysan qaadan toban daqiiqo si aad u hesho cabitaankaaga iyo 45 pizza macmacaan, laakiin goobta ayaa ku haboon.",pizza,neutral
"waxaan ku danbeysey in ay kaliya ka tagaan, sababtoo ah waxaan ahaa muhiimad ahaan la iska indha tiray by shaqaalaha sugitaanka - inkastoo inta kale ee makhaayad ahaa inta badan madhan, laakiin meesha waa wanaagsan, adeega waa saaxiibtinimo iyo xulashada non-sushi waa fiican yahay.",shaqaalaha,negative
"gaarka ah ee cashada ay waa cajiib ah, laakiin eeyaha kulul ayaa ka xun.",gaarka,positive
"waayo, ku dhowaad kow iyo toban bucks waxaad heshaa burrito weyn oo weyn (ama tacos), margarita, iyo macmacaan, laakiin shaqaalaha waa kibir iyo cuntadu waa ka hooseysaa celcelis ahaan.",tacos,positive
"waayo, ku saabsan kow iyo toban bucks waxaad ka heli burrito weyn (ama tacos), margarita, iyo macmacaan, laakiin cuntada waa ka niyad jabay iyo cuntada badda waa weyn.",margarita,neutral
"waayo, ku saabsan kow iyo toban bucks waxaad ka heli burrito weyn (ama tacos), margarita, iyo macmacaan, laakiin cuntada waa weyn iyo fursadaha vegan waa badan yahay.",toban,neutral
"waayo, ku saabsan kow iyo toban bucks waxaad heleysaa burrito weyn (ama tacos), margarita, iyo macmacaan, laakiin kalluunku waa celcelis ahaan waayo-aragnimada cuntadana waa mid aad u xun.",burrito,positive
"ku fiican cuntada degdegga ah, lakiin maraqiinka buskudka ee dhulka waa dhuuban yahay.",dhuuban,positive
"dibadda wax badan uma muuqato, laakin daqiiqada aad gudaha ku socotid, waa jawi kale oo dhan; sushi ayaa ka sii weyn.",jawi,positive
"dibadda wax badan uma muuqato, laakin daqiiqada aad gudaha ku socotid, waa jawi kale oo dhan; hilibka lo'da ee u macaan malab-mustarada gaaban feeraha gaaban waa macaan yihiin.",dibadda,negative
"waxaan u tagay in ay stock common for quraacda iyo waxaan ahaa si aad ula yaabay, laakiin dhadhan waa gaaban.",quraacda,neutral
"saaxiibkay wuxuu lahaa burger oo waxaan lahaa kuwan canjeero buluug cajiib ah, laakiin cuntada waa weyn, dhadhan waa buuxa iyo muuqaal waa weyn.",burger,neutral
"saaxiibkay wuxuu lahaa burger oo waxaan lahaa kuwan canjeero buluug ah oo cajiib ah, laakiin cuntada waa mid laga cabsado.",buluug ah,positive
"aad ayaan ugu faraxsannahay cuntadeena oo xitaa aad ayay noogu farxeen markii aan aragnay biilka, laakin sushi ayaa ka weyn.","biilka,",positive
"aad ayaan ugu faraxsannahay cuntadeena oo xitaa aad ayay noogu farxeen markii aan aragnay biilka, laakiin saxan waa la cuni karaa.",cuntadeena,positive
"waxay keenaan gaadhi saxaro ah ilaa miiskaaga waxayna kuu fidinayaan ilaa 7 ama 8 xulasho oo ah sauces for your steak (all ayaan isku dayay), laakiin qayb cunto ah ayaa ka hooseysa celceliska iyo adeega waa fiican yahay.",gaadhi,neutral
"waxay keenaan gaadhi saxaro ah ilaa miiskaaga waxayna kuu soo bandhigaan ilaa 7 ama 8 xulashooyin ah steak-kaaga (all baan isku dayay), laakiin feeraha ayaa wanaagsan.",isku,neutral
"waxay keenaan gaadhi saxaro ah ilaa miiskaaga waxayna kuu soo bandhigaan ilaa 7 ama 8 xulasho oo safaro ah oo loogu talagalay steak-kaaga (all baan isku dayay), laakiin dhadhanku waa ka xumaa.",xulasho,positive
"waxay keenaan gaadhi qamri ah ilaa miiskaaga waxayna kuu fidiyaan ilaa 7 ama 8 doorashooyin ah sauces for your steak (waxaan iyaga all tijaabiyey), laakiin cuntada chinese waa ka fiican yahay, meel waa nadiif ah oo cuntada waa caafimaad.",steak,neutral
"adeeggu wuxuu ahaa mid heegan u ah - maxaa kale ee aad ka filaysid ritz, laakiin martigeliyaha waa xushmad daro, laakin xushmad badan iyo qofkii sugayey waa xushmad daro.",adeeggu,positive
"macmacaan ayaa sidoo kale ahayd in ay u dhintaan, laakiin adeeggu waa mid liita adeeguna waa gaabis.",macmacaan,positive
"tayadda hilibka ayaa la mid ah bakkaarka cuntada ee xaafadaada, lakiin calamari waa mid guuleystay, saacadda farxadda lehna waa mid raqiis ah.",hilibka,negative
"service waxaa lagu yaqaan for laabaya ka badan dib si ay u ka dhigi qof walba ku faraxsanahay, laakiin bartender waa xushmad, kalluunka waa celcelis ahaan iyo adeega waa xun yahay.",service,positive
"suxuunta loo yaqaan ""roy's classics"" (oo lagu calaamadeynayo menu-ka oo ay ku yaallaan riwaayado) ayaa la isku dayaa in la isku dayo iyo saxanka runta ah, sida macadamia-jarjaran mahi mahi, ama si xeelad leh malab-khamiilka-khamiir udgoon oo jilbaha gaaban ee jilbaha, laakiin sushi ayaa ka weyn saxanna waa la cuni karaa.","classics""",positive
"suxuunta loo yaqaan ""roy's classics"" (oo lagu calaamadeynayo menu-ka leh dooorisks) ayaa la isku dayaa in la isku dayo iyo kuwa runta ah, sida macadamia-dillaacay mahi mahi, ama si xeelad macaan oo malab iyo khafiif ah oo u macaan feeraha gaaban ee lo'da, laakiin nalalka lama dareemo, kukiyada nasiibku waa cabasho iyo muusig aad u culus.",macadamia-dillaacay,positive
"suxuunta loo yaqaan ""roy's classics"" (oo lagu calaamadeynayo menu-ka leh dooorisyo) ayaa la isku dayaa in la isku dayo oo la cunteeyo, sida macadamia-dillaac mahi mahi, ama si xeeldheer oo malab iyo khardal udgoon ah feeraha gaaban ee gaaban, laakiin adeeggu waa ugu xun yahay, biilku waa weyn yahay iyo casho waa awood.",suxuunta,positive
"suxuunta loo yaqaan ""roy's classics"" (oo lagu calaamadeynayo menu-ka leh dooorisyo) ayaa la isku dayay in la isku dayo iyo run, sida macadamia-ciridka mahi mahi, ama si xeelad leh malab-khardal udgoon oo jilicsan oo jilicsan, laakiin sushi ayaa ka weyn, adeeggu wuu xun yahay adeeguna wuu ka xun yahay.",laakiin,positive
"suxuunta loo yaqaan ""roy's classics"" (oo lagu calaamadeynayo menu-ka leh xijaab) ayaa la isku dayaa in la isku dayo oo run ah, sida macadamia-dillaacay mahi mahi, ama si macdanta u macaan malab-khamiir-khamiir leh oo jilicsan oo gaaban feeraha gaaban, laakiin ambiance waa jaceyl, siddooyinka basasha ayaa ugu fiican iyo khudaarta way kala duwantahay.",menu,neutral
"suxuunta loo yaqaan ''roy's classics' (oo lagu calaamadeynayo menu-ka leh dooorisyo) ayaa la isku dayaa in la isku dayo oo la cuno, sida macadamia-dillaac mahi mahi, ama si xeeladaysan oo malab iyo khamiis ah oo u macaan feeraha gaaban ee jilbaha, laakiin maraq chickpea ee dhulka waa dhuuban yahay adeeguna waa midka ugu xun.",menu-ka,positive
"macmacaanka ugu fiican, shokolaatada iyo subagga looska ah, gaar uma aha hawaiian, laakin waa adduun yar marka laga hadlayo macmacaanka; waxaan isku dayaa jarjarada wanka iyo kombiyuutarada juice cusub waa cusub.",macmacaanka,neutral
"macmacaanka ugu fiican, shokolaatada iyo subagga looska ah, gaar uma aha hawaiian, laakin waa adduun yar marka laga hadlayo macmacaanka; kursiga laaluushka waa mid aan raaxo lahayn adeeguna aad ayuu u xun yahay.",adeeguna,positive
"macmacaanka ugu fiican, shokolaatada iyo subagga looska ah, gaar uma aha hawaiian, laakin waa adduun yar marka laga hadlayo macmacaanka; cuntadu waa mid aad u xun.",shokolaatada,positive
"liiska cashada wuxuu bixiyaa waxyaabo kala duwan oo laga galo, oo ay ku jiraan cuntada badda oo cusub iyo mareegaha waaweyn, waxaa sidoo kale jira labo qof oo aan hilibka ahayn oo kala duwan, laakiin cunto aan la karsanin cusub.",hilibka,positive
"menu qadada bixisaa noocyo kala duwan oo entrees weyn, oo ay ku jiraan cuntada badda cusub iyo steaks weyn, sidoo kale waxaa jira laba nooc oo kala duwan oo aan hilibka, laakiin fennel dhadhan sausage talyaani waa culus, digaag waa jacayl iyo wanka entrée waa fiican yahay.",noocyo,neutral
"liiska cashada wuxuu bixiyaa waxyaabo kala duwan oo laga galo weyn, oo ay ku jiraan cuntada badda cusub iyo mareegaha waaweyn, waxaa sidoo kale jira labo nooc oo kala duwan oo aan hilibka ahayn, laakiin kursiga laabma waa mid aan raaxo lahayn.",badda,positive
"menu cashada bixisaa noocyo kala duwan oo entrees weyn, oo ay ku jiraan cuntada badda cusub iyo steaks weyn, waxaa sidoo kale jira laba kale oo aan hilibka ahayn, laakiin shaqaalaha waa xun yahay, qiimaha ma qiimo iyo martigelin waa xushmad.",entrees,positive
"liiska cashada wuxuu bixiyaa waxyaabo kala duwan oo wax lagu galo, oo ay ku jiraan cuntada badda oo cusub iyo caruufo badan, waxaa sidoo kale jira labo nooc oo kala duwan oo aan hilibka ahayn, laakiin cunto ayaa niyad jabsan.",liiska,positive
"wax walba waa isdabajoog ah, laga bilaabo adeeg aad u fiican by waitresses cute, ilaa jawiga aad u jilicsan, laakiin casheeyayaasha waa awood, meel waa dhadhan iyo adeegga bar waa gaabis.",adeeg,positive
"wax walba waa la isdabajoogaa, laga bilaabo adeegga aadka u fiican by makhaayadaha cute, ilaa jawiga aad u jilicsan, laakiin dadka xanuunsan waa xushmad.",makhaayadaha,positive
"wax walba waa la isku qarqarxiyo, laga bilaabo adeegga aadka u fiican by makhaayadaha cute, ilaa jawiga aad u cajiiba, laakiin qolku waa caraabaah.",jawiga,positive
"runtii waxay bixiyaan jawiga nasashada, dib u jiidista, laakiin shaqaalaha sugitaanku waa mid aan fiiro gaarin, adeeguna waa mid gaabis ah.",jawiga,positive
"waxaan u imid inaan cusub filayo cunto weyn, waxa aan helay oo dhanna wuxuu ahaa mid aad u badan oo cunto ah oo lagu adeego makhaayad taas oo ahayd kaliya si baraf ah oo aan ku raaxaysan kari waynay inaan cunno, laakiin goobta waa mid isku habboon.",adeego,neutral
"waxaan u imid si cusub oo aan filayo cunto weyn, waxaan helay oo dhanna waxay ahayd mid si aad u fiican oo raashin ah oo lagu adeego makhaayad taas oo ahayd kaliya si baraf ah oo aan ku raaxaysan kari waynay inaan cunno, laakiin meeshu waa la jecel yahay iyo cuntada japanese waa mid hufan.",baraf,negative
"waxaan u imid si cusub oo aan ka filaayo cunto weyn, waxaan helay oo dhanna waxay ahayd mid marar badan cuntooyinka loo adeego makhaayad taas oo ahayd kaliya si baraf ah oo aan ku raaxaysan kari waynay inaan cunno, laakiin cuntada waa caafimaad.",cunto,negative
"our fadhiidnimo ayaa sida muuqata marnaba isku dayeen in mid ka mid ah cuntada, mana jirin cid ku talin karta khamri kasta, laakiin eeyaha kulul waa weyn yahay iyo adeeg waa ku faraxsan yahay.","cuntada,",neutral
"midiiheheenii sida muuqata marnaba ma aysan isku dayin mid ka mid ah cuntada, mana jirin cid ku talisa khamri, laakin cuntada la kariyey ayaa yaabban.","khamri,",neutral
"our midiidinyada ayaa sida muuqata marnaba isku dayi jirin in wax ka mid ah cuntada, mana jirin cid ku talin karta wax khamri ah, laakiin rooti quraacdu waa mid cajiib ah, cuntaduna waa wax weyn.",talin,negative
"appetizer-ka dhabanka halibut wuxuu la yimid qayb deeqsinimo leh oo cawska foie ah, laakiin taasi waxay ku saabsan tahay waxa kaliya ee wanaagsan ee aan ka dhihi karo cuntada; adeegga waa saaxiibtinimo iyo martida waa nimco.",halibut,neutral
"appetizer-ka dhabanka halibut wuxuu la yimid qayb deeqsinimo leh oo cawska foie ah, laakiin taasi waxay ku saabsan tahay waxa kaliya ee wanaagsan ee aan ka dhihi karo cuntada; kursi laaluushka waa raaxo, cookies fortune waa cabasho iyo chills cagaaran ma aha wax la cuni karo.",foie,positive
"the alaabta dhaqanka talyaani waa weyn - raqiis ah oo lagu adeegi jiray goob raaxo leh, laakiin maamulaha waa nimco la'aan ah, saxan waa la cuni karo iyo bixinta waa digtoonaan.",adeegi,positive
"the alaabta dhaqanka talyaaniga waa weyn - raqiis ah oo lagu adeegi jiray goob raaxo leh, laakiin adeeggu waa mid aad u xun.",goob,positive
"the alaabta dhaqanka talyaaniga waa weyn - raqiis ah oo lagu adeego goob raaxo leh, laakiin casseroles curried waa dhib badan.",talyaaniga,positive
"dhammaataan baastada al dente, oo aan lagu maansana suugo- qaybo deeqsi ah, laakiin adeeggu waa mid liita, adeeggu si xun ayuu u gaabiyaa, adeegguna waa mid aad u xun.",xun,positive
"dhammaataan baastada al dente, oo aan lagu maanshaynin suugogaal -- qaybo deeqsi ah, laakiin adeeggu waa ugu xun yahay.",baastada,positive
"dhammaataan baastada al dente, oo aan lagu maanshaynin suugaanta - qaybo deeqsi ah, laakiin sushi waa cusub.",suugaanta,neutral
"si fiican ayaanu u riyaaqnay oo waxaan dib ugu laaban doonnaa macmacaankii, laakiin cuntadu waa mid aan is-oggolayn.",ayaanu,positive
"my chelsea's menu cajiib ah oo hal abuur leh waxaa ka mid ah casriga ah, westernized suxuunta japanese sida foie gras unagi napolean, jap style steak hamburger, xawaare cod spicy spe spaghetti, cod madow saldhig miso, iyo hayayaashii wanka in sauce truffle madow, in la xuso dhowr ah, laakiin casho waa fiican iyo adeeg waa dushooda a.",spicy,neutral
"my chelsea's menu cajiib ah oo hal abuur leh ayaa waxaa ka mid ah casriga ah, westernized suxuunta japanese sida foie gras unagi napolean, jap style steak hamburger, spicy cod oo cawl spaghetti, cod madow leh saldhig miso, iyo hayayaashii wanka in suugo madow truffle, in la magacaabo dhowr ah, laakiin adeega waa weyn.",foie gras unagi napolean,neutral
"my chelsea's menu cajiib ah oo hal abuur leh waxaa ka mid ah casriga ah, westernized suxuunta japanese sida foie gras unagi napolean, jap style steak hamburger, spicy cod oo cawl spaghetti, cod madow saldhig miso, iyo hayayaashii wanka in suugo madow truffle, in la magacaabo dhowr ah, laakiin adeegga waa saaxiibtinimo, salads waa fiican yahay iyo goobta waa weyn.",madow,neutral
"my chelsea's menu cajiib ah oo hal abuur leh waxaa ka mid ah casriga ah, westernized suxuunta japanese sida foie gras unagi napolean, jap style steak hamburger, xawaare cod spghetti, cod madow oo leh saldhig miso, iyo hayayaashii wanka in suugo madow truffle, in la magacaabo dhowr ah, laakiin martida waa xushmad iyo maareeyaha waa nimcola'aan.",menu,positive
"my chelsea's menu cajiib ah oo hal abuur leh ayaa waxaa ka mid ah casriga ah, westernized suxuunta japanese sida foie gras unagi napolean, jap style steak hamburger, spicy cod roe spaghetti, cod madow oo leh saldhig miso, iyo hayayaashii wanka ee qashinka madow, in la magacaabo dhowr ah, laakiin qiimaha waa macquul.",madow,neutral
"my chelsea's menu cajiib ah oo hal abuur leh waxaa ka mid ah casriga ah, westernized suxuunta japanese sida foie gras unagi napolean, jap style steak hamburger, xawaare cod spetti, cod madow saldhig miso, iyo hayayaashii wanka in suugada truffle madow, in la magacaabo dhowr ah, laakiin appetizers ma aha qaali ah oo cuntada waa qaali.",suxuunta japanese,neutral
"my chelsea's menu cajiib ah oo hal abuur leh waxaa ka mid ah casriga ah, westernized suxuunta japanese sida foie gras unagi napolean, jap style steak hamburger, xawaash cod spicy cawsha spaghetti, cod madow oo leh saldhig miso, iyo hayayaashii wanka ee suugada truffle madow, in la magacaabo dhowr ah, laakiin casho waa qurux badan oo qurux badan oo qabow noodles sesame waa la delectable.","hamburger,",neutral
"macmacaantu waxay u dhawdahay wax aan la cajiib aheyn. qof ahaantayda aan jeclahay waa camalkooda maalinta, laakiin dhadhanku waa ka xumaataa.",macmacaantu,positive
"macmacaanku waa ku dhawaad cajiib ah: qof ahaantayda ugu jecel yahay waa tart ay maalinta, laakiin suga waa xumaan iyo chills cagaaran ma aha la wada cuni karo.","maalinta,",positive
"adeeg good, cunto weyn, qiimo wanaagsan, oo aan marnaba u leeyihiin in ay sugaan in line, laakiin miisaska waa uncomfortably dhow.",adeeg,positive
"adeeg wanaagsan, cunto weyn, qiimo wanaagsan, oo aan marnaba u leeyihiin in ay sugaan in line, laakiin maraqa mole waa mid aad u macaan.",sugaan,positive
"adeeg wanaagsan, cunto weyn, qiimo wanaagsan, oo aan marnaba u leeyihiin in ay sugaan in line, laakiin hilib lobster macmal ah waa macmal ah, adeegga waa xun yahay iyo dadka iibka waa xushmad daro.",qiimo,positive
"adeeg good, cunto weyn, qiimo wanaagsan, oo aan marnaba u leeyihiin in ay sugto in line, laakiin adeega waa gaabis, mid midiina waa ka xanaajiyay iyo qaybo waa yar yahay.",cunto,positive
"waxaa haboon in taksi in ay qaataan taksi si ay chelsea kaliya for casho laga cabsado ee my chelsea, laakiin ac waa la'aan ah, dhadhan waa ugu xun iyo cuntada waa qaali.",casho,positive
